subreddit,title,created_utc,compound,neg,neu,pos
worldnews,China's Guangxi deluged by flood-waters from upstream province,2025-06-27 00:39:46+00:00,0.0,0.0,1.0,0.0
worldnews,Germany defends end to funding Mediterranean migrant rescues,2025-06-27 00:34:52+00:00,0.3182,0.0,0.753,0.247
worldnews,"China hosts Iran, Russia defence ministers against backdrop of 'turmoil'",2025-06-27 00:33:34+00:00,-0.2732,0.21,0.672,0.118
worldnews,South Korean intelligence says North Korea to deploy more troops to Russia,2025-06-27 00:14:35+00:00,0.4767,0.0,0.78,0.22
worldnews,July deadline for tariffs may be extended,2025-06-27 00:06:23+00:00,0.0,0.0,1.0,0.0
worldnews,China Reacts to 'Massive' NATO Warning,2025-06-26 07:53:27+00:00,-0.34,0.324,0.676,0.0
worldnews,Deportation orders issued to 3 Iranian regime officials in Canada: CBSA,2025-06-26 04:47:20+00:00,0.0,0.0,1.0,0.0
worldnews,EU Warns a Baseline Trump Tariff Would Still Spur Retaliation,2025-06-26 23:36:08+00:00,-0.1027,0.135,0.865,0.0
worldnews,EU to launch accession talks with Moldova on July 4,2025-06-26 23:06:29+00:00,0.0,0.0,1.0,0.0
worldnews,First train from Pyongyang arrives in Moscow after five-year hiatus,2025-06-26 23:01:54+00:00,0.0,0.0,1.0,0.0
worldnews,Chinese MP7 becomes hot item among N. Korean youth,2025-06-26 22:53:55+00:00,0.0,0.0,1.0,0.0
worldnews,Canada changes work permit eligibility for international students,2025-06-26 22:53:21+00:00,0.0,0.0,1.0,0.0
worldnews,"Over 20,000 Russian soldiers prosecuted for refusing to fight in Ukraine, media reports",2025-06-26 22:25:15+00:00,-0.7845,0.441,0.559,0.0
worldnews,PM set to announce welfare climbdown in deal with Labour rebels,2025-06-26 21:47:01+00:00,-0.2023,0.153,0.847,0.0
worldnews,"Global energy CO2 emissions reached record high last year, report says",2025-06-26 21:30:15+00:00,0.3612,0.0,0.72,0.28
worldnews,"Ukrainian drones strike Russian S-400 air defense system in occupied Crimea, HUR says",2025-06-26 21:00:22+00:00,0.0,0.107,0.786,0.107
worldnews,"China aimed to sabotage Taiwanese vice president’s Czechia visit, intelligence confirms",2025-06-26 20:48:18+00:00,-0.0772,0.219,0.581,0.2
worldnews,Netanyahu: Win over Iran created opportunity to expand peace deals that must be seized,2025-06-26 20:45:50+00:00,0.9246,0.0,0.385,0.615
worldnews,EU mulls lowering tariffs on U.S. imports to reach trade deal - WSJ,2025-06-26 20:43:06+00:00,-0.2263,0.142,0.78,0.078
worldnews,"Strikes on Iran's Fordow enrichment site rendered it inoperable, Israeli atomic agency claims",2025-06-26 20:35:16+00:00,-0.3612,0.172,0.828,0.0
worldnews,"Israeli officials see ""significant"" damage to Iran's nuclear facilities",2025-06-26 20:35:16+00:00,-0.34,0.267,0.583,0.15
worldnews,Greece battles wildfire in coastal town near capital,2025-06-26 20:34:51+00:00,-0.3818,0.271,0.729,0.0
worldnews,Sikorski: Russia Pulls Majority of Troops from Kaliningrad - Militarnyi,2025-06-26 20:29:41+00:00,0.0,0.0,1.0,0.0
worldnews,Ukrainian intelligence drones destroy Russian air defence systems in Crimea – video,2025-06-26 20:08:11+00:00,0.0,0.206,0.529,0.265
worldnews,"China, India shift to higher-grade coal, cut Indonesian imports",2025-06-26 20:00:39+00:00,-0.2732,0.208,0.792,0.0
worldnews,West Bank: Three Palestinians killed during Israeli settler attack,2025-06-26 19:42:09+00:00,-0.8225,0.521,0.479,0.0
worldnews,Netanyahu thanks Trump for public call to cancel his corruption trial,2025-06-26 19:36:10+00:00,0.2263,0.144,0.647,0.209
worldnews,BBC to start charging US-based consumers for news and TV coverage,2025-06-26 19:32:13+00:00,0.0,0.0,1.0,0.0
worldnews,Details emerge of secret diplomatic efforts to restart Iran talks,2025-06-26 19:09:46+00:00,0.0,0.0,1.0,0.0
worldnews,Nearly one-third of Tuvalu citizens seek to live in Australia on climate visa,2025-06-26 18:20:23+00:00,0.0,0.0,1.0,0.0
worldnews,NSW politicians say cannabis decriminalisation inevitable after report points to unequal system,2025-06-26 18:10:08+00:00,-0.34,0.179,0.821,0.0
worldnews,"US gained nothing from strikes, Iran's supreme leader says",2025-06-26 17:36:18+00:00,0.8079,0.0,0.419,0.581
worldnews,"Over 20,000 Russian soldiers prosecuted for refusing to fight in Ukraine, media reports",2025-06-26 17:35:52+00:00,-0.7845,0.441,0.559,0.0
worldnews,Indian investigators download black box data from fatal Air India crash,2025-06-26 17:26:25+00:00,-0.7351,0.408,0.592,0.0
worldnews,Deportation orders issued to 3 Iranian regime officials in Canada: CBSA,2025-06-26 17:02:54+00:00,0.0,0.0,1.0,0.0
worldnews,B.C.‘s premier says measles spikes across Canada a result anti-vax ‘recklessness’,2025-06-26 16:59:04+00:00,0.0,0.0,1.0,0.0
worldnews,South Korea's Lee urges parliament to approve 'supplementary budget' to boost economy,2025-06-26 16:52:20+00:00,0.4019,0.0,0.803,0.197
worldnews,AG says Netanyahu cannot pick next Shin Bet chief due to ongoing probes of aides,2025-06-26 16:42:14+00:00,0.0,0.0,1.0,0.0
worldnews,"Ayatollah Khamenei says Iran dealt US 'severe slap', claims victory over Israel",2025-06-26 16:39:30+00:00,-0.25,0.183,0.704,0.113
worldnews,Ursula von der Leyen faces no-confidence vote over Pfizergate,2025-06-26 16:27:53+00:00,0.0,0.0,1.0,0.0
worldnews,Switzerland concerned about Russian satellite interference,2025-06-26 16:22:16+00:00,0.0,0.0,1.0,0.0
worldnews,Spain: Top court backs amnesty for Catalan separatists,2025-06-26 16:19:16+00:00,0.1531,0.133,0.667,0.2
worldnews,"Israel halts aid into northern Gaza, officials says, clans deny Hamas is stealing it",2025-06-26 16:06:33+00:00,-0.7269,0.337,0.663,0.0
worldnews,Jamaica to take fight for slavery reparations to King Charles,2025-06-26 16:05:59+00:00,-0.8126,0.481,0.519,0.0
worldnews,Iran’s Khamenei resurfaces to warn against future US attacks in first statement since ceasefire,2025-06-26 15:54:58+00:00,-0.5106,0.264,0.736,0.0
worldnews,"No known intelligence that Iran moved uranium, US defense chief says",2025-06-26 15:42:19+00:00,-0.503,0.334,0.561,0.105
worldnews,"Ukrainian forces halt Russian advance in Sumy region, says army chief",2025-06-26 15:33:06+00:00,0.0,0.0,1.0,0.0
worldnews,Canada’s Youth Job Market Slumps Most Among Major Economies,2025-06-26 15:29:55+00:00,0.0,0.0,1.0,0.0
worldnews,Russia Launches DDoS Attacks on Dutch Government Websites on Eve of NATO Summit,2025-06-26 15:23:01+00:00,-0.4404,0.195,0.805,0.0
worldnews,UN urges renewed political and climate action in Libya amid humanitarian and governance crises,2025-06-26 15:21:30+00:00,0.0,0.0,1.0,0.0
worldnews,"BYD slows production, delays capacity expansion at China factories, sources say",2025-06-26 15:12:13+00:00,0.0,0.0,1.0,0.0
worldnews,Campaign to expand Abraham Accords sparks backlash after al-Sharaa appears with Netanyahu,2025-06-26 15:10:50+00:00,0.3182,0.0,0.827,0.173
worldnews,Indian court rules trans women are women and ‘legally entitled to recognition’,2025-06-26 15:10:01+00:00,0.2732,0.0,0.84,0.16
worldnews,Witkoff: Countries not previously contemplated will soon join Abraham Accords,2025-06-26 14:53:44+00:00,0.296,0.0,0.804,0.196
worldnews,India refuses to sign SCO statement over claims of pro-Pakistan bias,2025-06-26 14:51:58+00:00,-0.1027,0.123,0.877,0.0
worldnews,Polish foreign minister says arms race could bring down Putin’s regime like it did with USSR,2025-06-26 14:45:02+00:00,0.3612,0.0,0.857,0.143
worldnews,Netanyahu asks court to postpone his corruption trial,2025-06-26 14:42:41+00:00,-0.2263,0.213,0.787,0.0
worldnews,Switzerland wants to examine cooperation with the EU in the defence sector,2025-06-26 14:19:00+00:00,0.1027,0.0,0.887,0.113
worldnews,"Ukraine, Council of Europe signed agreement to establish special tribunal for Russian aggression",2025-06-26 14:02:07+00:00,0.5719,0.122,0.552,0.326
worldnews,Iran's Guardian Council Approves Suspension Of Cooperation With UN Nuclear Watchdog,2025-06-26 14:01:26+00:00,0.4019,0.0,0.787,0.213
worldnews,International Astronomical Union awards PhD prize at-large to Kharkiv scientist who wrote PhD thesis under Russian attacks,2025-06-26 13:39:08+00:00,0.5267,0.125,0.603,0.272
worldnews,"Russia reportedly helping North Korea build warships, but questions over seaworthiness remain after failed launch",2025-06-26 13:36:55+00:00,-0.6249,0.295,0.622,0.083
worldnews,Ukraine calls for special court to try Russian war leaders – DW – 06/26/2025,2025-06-26 13:17:10+00:00,-0.296,0.21,0.645,0.145
worldnews,"North Korea may send more troops to Russia in July or August for Ukraine war, Seoul says",2025-06-26 13:08:50+00:00,-0.5994,0.196,0.804,0.0
worldnews,Russian Banks Fear Debt Crisis Is Coming as War Strains Economy,2025-06-26 12:39:32+00:00,-0.9423,0.726,0.274,0.0
worldnews,West Bank: Three Palestinians killed during Israeli settler attack,2025-06-26 11:41:18+00:00,-0.8225,0.521,0.479,0.0
worldnews,Cocaine use and production hits record high,2025-06-26 11:35:37+00:00,0.0,0.0,1.0,0.0
worldnews,"Defiant Ayatollah claims victory for Iran after hostilities with Israel, U.S.",2025-06-26 11:19:04+00:00,-0.6124,0.357,0.643,0.0
worldnews,Vietnam ends death penalty for 8 crimes,2025-06-26 10:41:19+00:00,-0.7845,0.58,0.42,0.0
worldnews,"Pakistan developing a nuclear missile that could reach US, new report reveals",2025-06-26 10:00:18+00:00,0.0258,0.0,0.909,0.091
worldnews,Iran turns to internal crackdown in wake of 12-day war,2025-06-26 09:53:11+00:00,-0.5994,0.302,0.698,0.0
worldnews,Hun Sen urges frontline residents to dig trenches amid border tensions,2025-06-26 09:26:11+00:00,-0.4019,0.213,0.787,0.0
worldnews,Putin’s henchmen now deeply ingrained at highest level of Slovakian government,2025-06-26 09:24:03+00:00,0.0,0.0,1.0,0.0
worldnews,"EU leaders meet to discuss tougher Russia sanctions, US tariffs and Middle East",2025-06-26 09:08:16+00:00,0.1779,0.0,0.876,0.124
worldnews,Ukraine and Council of Europe sign agreement to create tribunal to prosecute Putin over war — Meduza,2025-06-26 08:42:14+00:00,-0.3182,0.265,0.522,0.213
worldnews,"Thailand, the first country in Asia to legalise cannabis, is re-criminalising recreational sales",2025-06-26 08:20:15+00:00,0.0,0.0,1.0,0.0
worldnews,Trump's surprising exchange with Ukrainian reporter: 'Very upsetting',2025-06-26 08:12:51+00:00,-0.3167,0.295,0.522,0.183
worldnews,Discovery of HMS Endeavour wreck confirmed,2025-06-26 08:09:42+00:00,-0.4404,0.367,0.633,0.0
worldnews,"Thai PM, former Cambodian leader visit disputed border as tensions simmer",2025-06-26 08:05:36+00:00,-0.6249,0.362,0.638,0.0
worldnews,Iran’s defense minister goes to China on first reported foreign trip since conflict with Israel,2025-06-26 07:46:31+00:00,-0.2023,0.137,0.774,0.089
worldnews,China antigraft crackdown targets rare-earth producing areas,2025-06-26 07:39:20+00:00,0.0,0.0,1.0,0.0
worldnews,North Korea to open beach resort as Kim Jong Un bets on tourism,2025-06-26 07:09:59+00:00,0.0,0.0,1.0,0.0
worldnews,"Explosions Rock Moscow as 50 Drones Target Russian Regions, Vnukovo Flights Diverted",2025-06-26 06:53:38+00:00,0.0,0.0,1.0,0.0
worldnews,Swiss government proposes restrictions on Ukrainian refugees,2025-06-26 06:31:03+00:00,0.0,0.0,1.0,0.0
worldnews,Work-related mental health cases hit record high in Japan,2025-06-26 05:52:20+00:00,0.0,0.0,1.0,0.0
worldnews,Mushroom jury to begin deliberations next week,2025-06-26 05:46:03+00:00,0.0,0.0,1.0,0.0
worldnews,Russia still getting spare parts for aircrafts despite sanctions.,2025-06-26 05:37:37+00:00,0.0,0.0,1.0,0.0
worldnews,Colombian waste pickers inundate iconic Bogota square with plastic bottles to protest falling wages,2025-06-26 05:27:24+00:00,-0.6597,0.368,0.632,0.0
worldnews,"Astronauts from India, Poland, Hungary launched on first space station mission",2025-06-26 04:16:11+00:00,0.128,0.0,0.87,0.13
worldnews,Trump criticizes Spain’s refusal to raise NATO spending,2025-06-26 04:08:03+00:00,-0.34,0.255,0.745,0.0
worldnews,"/r/WorldNews Live Thread: Russian Invasion of Ukraine Day 1218, Part 1 (Thread #1365)",2025-06-26 04:02:26+00:00,0.0,0.0,1.0,0.0
worldnews,Putin's Billionaires Dodge Sanctions by Financing Lawsuits,2025-06-26 03:54:27+00:00,-0.1531,0.211,0.789,0.0
worldnews,France's far-right leader Le Pen asks protégé Bardella to prepare for 2027 presidential run,2025-06-26 02:46:16+00:00,0.0,0.0,1.0,0.0
worldnews,"S. Korea, NATO agree to establish consultative body on defense industry",2025-06-26 02:44:01+00:00,0.4588,0.0,0.692,0.308
worldnews,Synthetic Human Genome Project gets go ahead,2025-06-26 02:41:16+00:00,0.0,0.0,1.0,0.0
worldnews,"Drug kingpin ‘Fito,’ Ecuador’s most wanted man, has been captured, says Ecuador’s president",2025-06-26 02:23:32+00:00,0.0,0.0,1.0,0.0
worldnews,Serbia halts all arms exports amid Russian scrutiny over Ukraine,2025-06-26 02:19:12+00:00,0.0,0.0,1.0,0.0
worldnews,Israeli attacks kill at least 78 as Trump signals progress in Gaza talks,2025-06-26 00:35:57+00:00,-0.7003,0.373,0.49,0.137
worldnews,At least 16 people dead as anti-government protests grip Kenya,2025-06-25 23:45:22+00:00,-0.7351,0.437,0.563,0.0
worldnews,Israeli forces kill three Palestinians after settlers attack West Bank town,2025-06-25 23:02:27+00:00,-0.8316,0.464,0.536,0.0
worldnews,"Just three years to limit global warming to 1.5C, top scientists warn",2025-06-25 22:39:52+00:00,0.25,0.101,0.652,0.246
worldnews,Europeans still aren't buying Teslas with sales drop in Europe for fifth month in a row,2025-06-25 22:25:17+00:00,-0.2732,0.123,0.877,0.0
worldnews,"World Bank approves $1bn for development projects in Iraq, Syria and Lebanon",2025-06-25 22:15:57+00:00,0.4019,0.0,0.803,0.197
worldnews,"Russia Advancing Long-Term Economic Ties With India, Key Partners: Vladimir Putin",2025-06-25 20:52:03+00:00,0.0,0.0,1.0,0.0
worldnews,CIA says intelligence indicates Iran's nuclear program severely damaged,2025-06-25 20:51:48+00:00,-0.4215,0.393,0.4,0.207
worldnews,"Trump says US will meet with Iran next week, asserts nuke deal ‘no longer necessary’",2025-06-25 20:46:40+00:00,0.0,0.0,1.0,0.0
worldnews,"Canada isn't looking to join EU, Carney says, but still wants closer ties",2025-06-25 20:21:35+00:00,-0.1139,0.107,0.893,0.0
worldnews,Saudi Arabia drops France’s EDF from desert megacity project,2025-06-25 20:04:22+00:00,0.0,0.0,1.0,0.0
worldnews,Iran says nuclear sites ‘badly damaged’ amid conflicting reports on strikes’ success,2025-06-25 19:56:58+00:00,0.25,0.165,0.61,0.226
worldnews,"Tuesday’s Fête nationale holiday was the hottest June day in Montreal since records started, Environment Canada says.",2025-06-25 19:45:09+00:00,0.4019,0.0,0.856,0.144
worldnews,At Least 8 Killed as Protesters Battle Police in Kenya,2025-06-25 18:43:28+00:00,-0.8402,0.562,0.438,0.0
worldnews,"Israeli commandos operated inside Iran during war, IDF chief says",2025-06-25 18:39:30+00:00,-0.5994,0.302,0.698,0.0
worldnews,Ukraine Unveils Its Own “KAB” Glide Bombs—Finally Hits Back at Russian Tactics,2025-06-25 18:29:46+00:00,0.0,0.0,1.0,0.0
worldnews,Canada border bill: Advocacy groups express privacy concerns,2025-06-25 18:03:15+00:00,0.0,0.0,1.0,0.0
worldnews,Zelenskyy after meeting with Trump: “We talked about the battlefield. Putin is definitely not winning”,2025-06-25 17:42:04+00:00,0.0258,0.142,0.71,0.148
worldnews,Australian navy joins UK to conduct freedom of navigation exercises in contested South China Sea,2025-06-25 17:39:03+00:00,0.6369,0.0,0.769,0.231
worldnews,NATO’s Rutte likens Trump to a ‘daddy’ in Israel-Iran conflict,2025-06-25 17:32:39+00:00,-0.3182,0.204,0.796,0.0
worldnews,"Putin will not go to BRICS summit in Brazil due to ICC arrest warrant, Kremlin aide says",2025-06-25 16:59:20+00:00,-0.34,0.13,0.87,0.0
worldnews,Canadian border agency investigating dozens of cases of potential Iranian officials allowed into Canada,2025-06-25 16:25:21+00:00,0.0,0.0,1.0,0.0
worldnews,Shell considers acquiring BP in potential mega oil deal - WSJ,2025-06-25 16:00:46+00:00,0.0,0.0,1.0,0.0
worldnews,Iran’s parliament votes to expel and end cooperation with UN nuclear inspectors and Nuclear Watchdog after U.S.–Israel strikes,2025-06-25 15:56:29+00:00,-0.6597,0.252,0.748,0.0
worldnews,UK PM Starmer faces a historic revolt as 120+ Labour MPs defy his £5 bn welfare cuts,2025-06-25 15:48:58+00:00,-0.296,0.121,0.879,0.0
worldnews,UK to buy Ukraine air defence missiles using £70m interest from frozen Russian assets,2025-06-25 15:38:47+00:00,0.6249,0.0,0.643,0.357
worldnews,"Vietnam to remove death penalty for embezzlement, sparing tycoon's life",2025-06-25 15:22:14+00:00,-0.7845,0.463,0.537,0.0
worldnews,NATO allies agree on 5% GDP defence spending,2025-06-25 15:08:49+00:00,0.4404,0.0,0.606,0.394
worldnews,Trump and Zelenskyy hold 45-minute meeting in The Hague: details,2025-06-25 15:07:57+00:00,0.0,0.0,1.0,0.0
worldnews,Japan conducts first domestic surface-to-ship missile test,2025-06-25 14:49:11+00:00,0.0,0.0,1.0,0.0
worldnews,Early US intelligence report suggests US strikes only set back Iran’s nuclear program by months,2025-06-25 14:43:39+00:00,0.1531,0.134,0.699,0.167
worldnews,"'Jai Iran-Jai Hind': Iran embassy claims victory, thanks India for support",2025-06-25 14:37:17+00:00,0.6808,0.0,0.616,0.384
worldnews,NATO defence spending: Canada commits to 5% pledge,2025-06-25 14:20:43+00:00,0.128,0.0,0.706,0.294
worldnews,"Pro Cannabis Groups in Thailand Say Proposed Recriminalization of Cannabis is Purely Political, Urge Proper Passing of Laws",2025-06-25 14:07:13+00:00,0.0,0.0,1.0,0.0
worldnews,Trump declares Iran 'victory for everybody' despite doubts over damage,2025-06-25 13:24:20+00:00,0.5448,0.0,0.639,0.361
worldnews,"Thailand moves to recriminalise cannabis, shaking $1 billion industry",2025-06-25 13:23:58+00:00,-0.1779,0.175,0.825,0.0
worldnews,Russia frees REvil hackers after sentencing,2025-06-25 13:18:10+00:00,0.1531,0.205,0.513,0.282
worldnews,Rubio surprises NATO allies with softer rhetoric on Russia sanctions,2025-06-25 12:51:40+00:00,0.2263,0.0,0.826,0.174
worldnews,Thailand takes further step to tighten control on sales of cannabis,2025-06-25 12:41:50+00:00,0.0,0.0,1.0,0.0
worldnews,NATO summit commits to higher spending and collective defence,2025-06-25 12:40:25+00:00,0.128,0.0,0.737,0.263
worldnews,Japan foreign minister stresses importance of Israel-Iran cease-fire,2025-06-25 12:37:44+00:00,-0.128,0.261,0.522,0.217
worldnews,"Israel-Iran ceasefire holds, offering hope, but also uncertainty as Iran threatens to accelerate nuclear work",2025-06-25 12:35:08+00:00,-0.6757,0.318,0.587,0.095
worldnews,NATO allies agree to higher 5% defense spending target,2025-06-25 12:26:15+00:00,0.4588,0.0,0.636,0.364
worldnews,Drone debris from Shahed with automated thermal targeting module found in Ukraine,2025-06-25 12:09:08+00:00,0.0,0.0,1.0,0.0
worldnews,UK to fund joint drone production with Ukraine,2025-06-25 11:47:08+00:00,0.0,0.0,1.0,0.0
worldnews,"India, Poland and Hungary make spaceflight comeback with ISS mission",2025-06-25 11:40:05+00:00,0.0,0.0,1.0,0.0
worldnews,"Millions of children at risk as global vaccine rates fall, study finds",2025-06-25 11:38:58+00:00,-0.2732,0.16,0.84,0.0
worldnews,Switzerland to explore defence procurement pact with EU,2025-06-25 11:34:40+00:00,0.1027,0.0,0.833,0.167
worldnews,Families of Gaza hostages ask Donald Trump for new ceasefire deal,2025-06-25 11:25:05+00:00,0.0,0.0,1.0,0.0
worldnews,Right-wing party wants priority for Swiss citizens in Zurich housing,2025-06-25 11:10:25+00:00,0.4019,0.0,0.769,0.231
worldnews,UK used Russia-linked funds to buy weapons for Ukraine for the first time,2025-06-25 10:55:06+00:00,-0.4404,0.195,0.805,0.0
worldnews,"Orbán: ""Ukraine is not NATO member and I intend to keep it that way""",2025-06-25 10:13:30+00:00,0.0,0.0,1.0,0.0
worldnews,"Shares hit record high, oil plummets with market sentiment buoyed by Iran-Israel truce",2025-06-25 10:09:43+00:00,0.296,0.0,0.845,0.155
worldnews,"At least 120 children have been abducted by insurgents in Mozambique, rights group says",2025-06-25 10:09:39+00:00,-0.5106,0.202,0.798,0.0
worldnews,Iran Arrests 700 People for Alleged Ties to Israeli Spy Network,2025-06-25 09:29:45+00:00,-0.4404,0.225,0.775,0.0
worldnews,Talk of regime change resonates with Iranians fleeing across border,2025-06-25 09:02:04+00:00,0.0,0.0,1.0,0.0
worldnews,Putin authorises creation of state messaging app to combat WhatsApp and Telegram,2025-06-25 08:03:14+00:00,-0.0772,0.166,0.69,0.145
worldnews,India sends its first astronaut into space after 41 years,2025-06-25 07:50:42+00:00,0.0,0.0,1.0,0.0
worldnews,"PACE calls on Russia to uphold prisoner swaps, condemns abuse of Ukrainian captives.""The Parliamentary Assembly of the Council of Europe (PACE) has called on the international community to support negotiations between Ukraine and Russia for the swift exchange and release of all prisoners of war.""",2025-06-25 07:44:50+00:00,-0.9403,0.3,0.626,0.074
worldnews,Indian Navy to commission stealth ship Tamal on July 1 in Russia,2025-06-25 07:27:21+00:00,-0.0772,0.106,0.894,0.0
worldnews,China's Xi to skip BRICS summit in Brazil,2025-06-25 07:19:39+00:00,0.0,0.0,1.0,0.0
worldnews,Uk to purchase nuclear carrying fighter jet,2025-06-25 07:19:17+00:00,0.1531,0.0,0.789,0.211
worldnews,Drone debris found in Ukraine indicates Russia is using new technology from Iran,2025-06-25 07:04:53+00:00,0.0,0.0,1.0,0.0
worldnews,Iran parliament approves bill to suspend cooperation with IAEA | The Jerusalem Post,2025-06-25 06:58:59+00:00,0.1027,0.144,0.688,0.169
worldnews,"Canada, EU sign defense pact that could enable joint weapons work",2025-06-25 06:57:54+00:00,-0.34,0.216,0.672,0.112
worldnews,Norway to develop and produce USV in Ukraine,2025-06-25 06:57:34+00:00,0.0,0.0,1.0,0.0
worldnews,US intelligence report suggests US strikes on Iran only setback nuclear programme by months,2025-06-25 06:08:29+00:00,0.1531,0.142,0.682,0.176
worldnews,Seven IDF soldiers killed in Khan Yunis explosion,2025-06-25 05:31:35+00:00,-0.6705,0.391,0.609,0.0
worldnews,Turkish Tourism Faces Criticism Over Declining Quality and Controversial Nightlife in Marmaris,2025-06-25 04:43:30+00:00,-0.5719,0.32,0.68,0.0
worldnews,"Cuban regime intensifies its ""exemplary trials"" for drug and violence offenses",2025-06-25 04:37:08+00:00,-0.765,0.423,0.577,0.0
worldnews,Iran arrests European accused of spying for Israel – Fars News,2025-06-25 04:23:59+00:00,-0.6249,0.362,0.638,0.0
worldnews,Carney Justified Attacks While Iranian Canadians Feared The Worst,2025-06-25 04:19:09+00:00,-0.8176,0.57,0.279,0.151
worldnews,S. Korea sees fastest on-year growth in births in 34 yrs in April. Newborns rising 10 month straight,2025-06-25 04:15:46+00:00,0.5423,0.0,0.78,0.22
worldnews,Iran hangs three men for spying for Israel,2025-06-25 04:13:55+00:00,0.0,0.0,1.0,0.0
worldnews,"/r/WorldNews Live Thread: Russian Invasion of Ukraine Day 1217, Part 1 (Thread #1364)",2025-06-25 04:02:21+00:00,0.0,0.0,1.0,0.0
worldnews,Carney says Trump is no longer interested in annexing Canada,2025-06-25 03:24:47+00:00,-0.5358,0.358,0.642,0.0
worldnews,Five members of biggest British Jewish body suspended over Israel criticisms,2025-06-25 03:23:41+00:00,-0.6124,0.357,0.643,0.0
worldnews,Iran President says US entered conflict after witnessing ‘Israel’s impotence’,2025-06-25 02:40:42+00:00,-0.3182,0.204,0.796,0.0
worldnews,Italy has withdrawn its support for a draft EU law to combat greenwashing,2025-06-25 01:13:41+00:00,-0.0258,0.23,0.606,0.164
worldnews,Russian naval ship ‘disguised’ itself while passing through English Channel,2025-06-24 22:58:47+00:00,0.0,0.0,1.0,0.0
worldnews,French anti-fraud authorities order Tesla to stop 'deceptive commercial practices' regarding the fully autonomous driving capabilities of Tesla vehicles,2025-06-24 22:54:13+00:00,-0.296,0.109,0.891,0.0
worldnews,Starmer to give missiles to Ukraine paid for with £70m interest on Russian assets,2025-06-24 22:27:55+00:00,0.5719,0.0,0.719,0.281
worldnews,"Trump says China can buy Iranian oil, urges it to by US crude",2025-06-24 22:08:08+00:00,-0.5719,0.236,0.764,0.0
worldnews,Nigeria and Brazil sign $1 billion agreement to boost agriculture,2025-06-24 21:40:12+00:00,0.7096,0.0,0.576,0.424
worldnews,China hits 1 TW solar milestone,2025-06-24 21:21:42+00:00,0.0,0.0,1.0,0.0
worldnews,Israeli Ambassador Yechiel Leiter to Iranians: Now is the time to help yourselves,2025-06-24 21:17:05+00:00,0.4019,0.0,0.816,0.184
worldnews,"Baku, Azerbaijan to host conference on decolonization of the French overseas department of Guadeloupe",2025-06-24 21:05:25+00:00,0.0,0.0,1.0,0.0
worldnews,Netanyahu said weighing snap elections in light of popular Iran offensive,2025-06-24 21:03:50+00:00,-0.0516,0.203,0.608,0.189
worldnews,"Zelenskyy: Russia has launched 28,743 Shahed drones on Ukraine since 2022",2025-06-24 20:19:13+00:00,0.128,0.0,0.87,0.13
worldnews,Rights group warns against increased Russia attacks on Sumy City in Ukraine,2025-06-24 20:04:29+00:00,-0.296,0.279,0.584,0.136
worldnews,Oil prices tumble as Israel agrees to ceasefire with Iran,2025-06-24 19:51:18+00:00,0.2023,0.0,0.833,0.167
worldnews,"Netanyahu declares historic win, commits to campaign against Iran axis, Hamas",2025-06-24 19:46:51+00:00,0.5994,0.0,0.647,0.353
worldnews,Colombian army frees 57 soldiers detained by locals,2025-06-24 19:43:27+00:00,-0.128,0.248,0.55,0.202
worldnews,"Early US intel assessment suggests strikes on Iran did not destroy nuclear sites, sources say",2025-06-24 19:04:27+00:00,0.09,0.136,0.708,0.155
worldnews,"Grain-fed cattle emissions 56 per cent lower than previous estimates, research finds",2025-06-24 19:02:01+00:00,-0.296,0.167,0.833,0.0
worldnews,"LNG Canada achieves first production of liquefied natural gas in Kitimat, B.C.",2025-06-24 18:56:29+00:00,0.3612,0.0,0.815,0.185
worldnews,UK government to invest $1b to fight rising Chinese espionage,2025-06-24 18:32:01+00:00,-0.3818,0.224,0.776,0.0
