subreddit,title,created_utc,compound,neg,neu,pos
investing,"US sin stocks? ETFs, behaviour",2025-06-06 18:43:11+00:00,-0.5574,0.474,0.526,0.0
investing,Updates to the S&P 500 + HOOD?,2025-06-06 18:06:37+00:00,0.0,0.0,1.0,0.0
investing,Diversification Question regarding single stock.,2025-06-06 18:04:09+00:00,0.0,0.0,1.0,0.0
investing,ESPP (Company Stock Purchase Plan),2025-06-06 16:53:40+00:00,0.0,0.0,1.0,0.0
investing,Are there any portfolio trackers that include XIRR  or TWR calculations?,2025-06-06 16:15:34+00:00,0.0,0.0,1.0,0.0
investing,Will AI trigger a recession and reshape investing in the next 10 years?,2025-06-06 16:04:28+00:00,-0.4215,0.189,0.811,0.0
investing,Ethical investing and Palantir,2025-06-06 15:27:28+00:00,0.5106,0.0,0.476,0.524
investing,ChatGPT research recommended portfolio,2025-06-06 15:08:13+00:00,0.2023,0.0,0.625,0.375
investing,Investment Books that are worth ...the investment,2025-06-06 14:23:48+00:00,0.2263,0.0,0.759,0.241
investing,"If World War 3 really happens, what happens to our stock investments?",2025-06-06 14:14:04+00:00,-0.5994,0.262,0.738,0.0
investing,BRICS currencies could soon over take the dollar,2025-06-06 12:38:32+00:00,0.0,0.0,1.0,0.0
investing,"Daily General Discussion and Advice Thread - June 06, 2025",2025-06-06 09:01:03+00:00,0.0,0.0,1.0,0.0
investing,Stocks that pay dividends,2025-06-06 06:17:52+00:00,-0.1027,0.318,0.682,0.0
investing,Everyone talks about YMAX Nav Erosion,2025-06-06 03:30:38+00:00,0.0,0.0,1.0,0.0
investing,Feel like my portfolio is too focused on the US,2025-06-05 22:35:19+00:00,0.6249,0.0,0.611,0.389
investing,What questions do you ask during due diligence inquiries,2025-06-05 22:07:20+00:00,0.0,0.0,1.0,0.0
investing,Couldn't access Robinhood IPO Access,2025-06-05 21:09:59+00:00,0.0,0.0,1.0,0.0
investing,Do You Regret Your Decision?,2025-06-05 20:43:28+00:00,-0.4215,0.412,0.588,0.0
investing,Dollar Devaluation and What to do About it,2025-06-05 19:07:51+00:00,0.0,0.0,1.0,0.0
investing,Invest lump sum now or high yield?,2025-06-05 18:28:46+00:00,0.0,0.0,1.0,0.0
investing,AgEagle Aerial Systems (NYSE: UAVS),2025-06-05 18:02:33+00:00,0.0,0.0,1.0,0.0
investing,Should I move some of my NVDA stock to S&P500 or something else?,2025-06-05 17:34:06+00:00,0.0,0.0,1.0,0.0
investing,"How will, if at all, will the Trump and Musk rift effect markets?",2025-06-05 17:16:19+00:00,0.0,0.0,1.0,0.0
investing,What would you do with $200K you might need in 2–3 years?,2025-06-05 16:51:42+00:00,0.0,0.0,1.0,0.0
investing,Nvidia's 24M shares on Coreweave,2025-06-05 15:41:07+00:00,0.296,0.0,0.645,0.355
investing,"50,000 loan at. 2.99% interest. Lucrative Investment?",2025-06-05 15:29:08+00:00,0.4588,0.0,0.667,0.333
investing,I want advice about Indian stocks that are shariah compliant,2025-06-05 14:43:42+00:00,0.0772,0.0,0.874,0.126
investing,The mining sector is having a bull run this year.,2025-06-05 13:46:08+00:00,0.0,0.0,1.0,0.0
investing,As CoreWeave's (CRWV) Stock Value Flies - Shareholders Increasingly Turn to Nebius (NBIS) in Shifting AI Cloud Landscape,2025-06-05 13:30:50+00:00,0.34,0.0,0.876,0.124
investing,"Market Direction, TQQQ to SQQQ",2025-06-05 13:27:37+00:00,0.0,0.0,1.0,0.0
investing,Lots about to happen next week and into Q3/Q4,2025-06-05 12:59:16+00:00,0.0,0.0,1.0,0.0
investing,Costco Vs NVidia compare P/E and growth rates,2025-06-05 11:18:02+00:00,0.3818,0.0,0.729,0.271
investing,"Daily General Discussion and Advice Thread - June 05, 2025",2025-06-05 09:01:29+00:00,0.0,0.0,1.0,0.0
investing,Who‘s with me on the T2(taketwo) train? My bag is at around 1000$ and adding 100$ weekly,2025-06-05 08:47:21+00:00,0.0,0.0,1.0,0.0
investing,From $30k to $85k - Invest Help,2025-06-05 08:46:16+00:00,0.4019,0.0,0.69,0.31
investing,What to do with additional money after funding investments?,2025-06-05 07:16:35+00:00,0.0,0.0,1.0,0.0
investing,Previous Employer 401k Question,2025-06-05 03:45:47+00:00,0.0,0.0,1.0,0.0
investing,Any good Money Market Screeners?,2025-06-05 03:24:32+00:00,0.4404,0.0,0.58,0.42
investing,Investment options for house down payment?,2025-06-05 02:44:58+00:00,0.0,0.0,1.0,0.0
investing,Best place to put retirement funding till the volatility cools off,2025-06-05 02:39:57+00:00,0.6369,0.0,0.704,0.296
investing,Can I Partially Rollover a Roth IRA to a SDIRA and Still Do Backdoor Roth?,2025-06-05 01:36:55+00:00,0.0,0.0,1.0,0.0
investing,Does this feel anything like the dot.com bubble?,2025-06-05 01:04:59+00:00,0.3612,0.0,0.737,0.263
investing,AI reminds me of Pets.com of 2000 Dot Com crash,2025-06-05 00:49:52+00:00,-0.4019,0.231,0.769,0.0
investing,Thought experiment where investing and personal finance heavily taught in school,2025-06-04 23:35:09+00:00,0.0,0.0,1.0,0.0
investing,Seeking Simple Long-Term Investment Advice,2025-06-04 23:07:26+00:00,0.0,0.0,1.0,0.0
investing,what happened if i got hacked??,2025-06-04 20:59:05+00:00,-0.4696,0.38,0.62,0.0
investing,Toyota Industries board to evaluate $42B buyout proposal,2025-06-04 22:51:15+00:00,0.0,0.0,1.0,0.0
investing,Taxable brokerage account: Dividend Paying ETFs,2025-06-04 22:10:56+00:00,0.0,0.0,1.0,0.0
investing,How does one build a conservative portfolio in this economic environment?,2025-06-04 22:03:15+00:00,0.0,0.0,1.0,0.0
investing,Proceed as planned or wait,2025-06-04 21:26:49+00:00,0.0,0.0,1.0,0.0
investing,Using AI for calculations and/or investment strategy,2025-06-04 21:05:50+00:00,0.0,0.0,1.0,0.0
investing,Managed Futures and long-term profitability,2025-06-04 19:46:54+00:00,0.2732,0.0,0.656,0.344
investing,Question about selling covered calls in taxed account.,2025-06-04 19:34:08+00:00,0.0,0.0,1.0,0.0
investing,Where Gold Sits Today? Here are some numbers to consider,2025-06-04 18:44:42+00:00,0.0,0.0,1.0,0.0
investing,Is now a bad time to invest in bonds?,2025-06-04 18:21:14+00:00,-0.5423,0.304,0.696,0.0
investing,"Trying to clean up portfolio - FSKAX, FXAIX and FTIHX?",2025-06-04 18:19:47+00:00,0.4019,0.0,0.769,0.231
investing,Got scammed! Need advice!,2025-06-04 17:44:38+00:00,0.0,0.0,1.0,0.0
investing,"AMD, ADI, MPWR or NXPI? Who is going to profit after Nvda?",2025-06-04 17:09:53+00:00,0.504,0.0,0.771,0.229
investing,Advice Needed: What is an investment equivalent to Whole Life Insurance?,2025-06-04 16:44:23+00:00,0.0,0.0,1.0,0.0
investing,A new AI ETF just launched,2025-06-04 16:40:29+00:00,0.128,0.0,0.769,0.231
investing,Curious where folks are going with new investment,2025-06-04 16:20:41+00:00,0.3182,0.0,0.753,0.247
investing,Argument for the P/E ratio new paradigm,2025-06-04 16:01:21+00:00,-0.3612,0.294,0.706,0.0
investing,Robinhood Issue (naked call),2025-06-04 15:45:21+00:00,0.0,0.0,1.0,0.0
investing,Low Risk Investment for Safety Net,2025-06-04 14:46:54+00:00,-0.1027,0.42,0.3,0.28
investing,Dividend Capture Strategy Opinions,2025-06-04 14:30:19+00:00,0.0,0.0,1.0,0.0
investing,"For RTO mergers requiring a $4 listing price, how critical is that threshold?",2025-06-04 14:15:17+00:00,-0.3182,0.161,0.839,0.0
investing,On the risks of unregulated brokers and trading software: What MT5 doesn't tell you,2025-06-04 13:41:44+00:00,-0.2732,0.139,0.861,0.0
investing,ABP: Always Be Prospecting,2025-06-04 13:35:32+00:00,0.0,0.0,1.0,0.0
investing,"(Dry, Boring) Book About Fundamentals?",2025-06-04 13:26:48+00:00,-0.3182,0.365,0.635,0.0
investing,Have you ever used AI to help you invest? Like ChatGPT or other tools?,2025-06-04 13:12:06+00:00,0.6767,0.0,0.683,0.317
investing,"Global Defense Sector Poised for Growth: Analysis of EU, Asian & Australian Defense Spending Surge",2025-06-04 11:02:13+00:00,0.6808,0.0,0.591,0.409
investing,"Daily General Discussion and Advice Thread - June 04, 2025",2025-06-04 09:01:01+00:00,0.0,0.0,1.0,0.0
investing,Is now still a good time to invest in silver?,2025-06-04 06:36:06+00:00,0.4404,0.0,0.756,0.244
investing,Stock for Marvelous Inc. (7844.T) make good games like Rune Factory and Sakuna anime. They are to release their new game Guardians of Azuma tomorrow. With the dollar to yen exchange rate the stock is affordable at 489 yen a share. Is the Tokyo Stock exchange and foreign exchange stocks worth it?,2025-06-04 04:56:06+00:00,0.9081,0.0,0.778,0.222
investing,Div payment different than expected?,2025-06-04 03:30:28+00:00,0.0,0.0,1.0,0.0
investing,The Problem with Posting about Large Sums of Cash,2025-06-04 02:59:57+00:00,-0.4019,0.252,0.748,0.0
investing,How to manage larger accounts?,2025-06-04 02:43:26+00:00,0.0,0.0,1.0,0.0
investing,Should I do market order or limit order on gold etf due to constant increase in prices?,2025-06-04 02:20:06+00:00,0.3182,0.0,0.874,0.126
investing,Interest from HYS to DCA?,2025-06-04 01:35:08+00:00,0.4588,0.0,0.571,0.429
investing,Should I keep company stock from ESPP or diversify it?,2025-06-03 21:54:20+00:00,0.0,0.0,1.0,0.0
investing,Transferred FXAIX from Fidelity to Schwab. Should I keep investing in it or start with SWPPX?,2025-06-03 19:50:05+00:00,0.0,0.0,1.0,0.0
investing,Ive been seeing NBIS compared to CRWV as the better stock.,2025-06-03 19:30:06+00:00,0.4404,0.0,0.775,0.225
investing,How do y’all feel about Uranium?,2025-06-03 19:20:41+00:00,0.0,0.0,1.0,0.0
investing,"QBTS D-Wave Quantum, is this going to be the new nvidia?",2025-06-03 17:55:44+00:00,0.0,0.0,1.0,0.0
investing,401k - Investment other than stocks?,2025-06-03 17:54:56+00:00,0.0,0.0,1.0,0.0
investing,About buying stocks at a certain time vs when I finally get it? Will i gain profit at that time of purchase or not?,2025-06-03 17:28:45+00:00,0.8299,0.0,0.706,0.294
investing,"Have been Traget Date Funds 100% in 401k for last 15 years.. Have 20 more years to hit 60, Can i make this change???",2025-06-03 16:11:00+00:00,0.0,0.0,1.0,0.0
investing,BANK OF AMERICA- MERRILL LYNCH,2025-06-03 15:47:10+00:00,0.0,0.0,1.0,0.0
investing,Diversifying portfolio tips/rec’s I should consider or look into,2025-06-03 14:37:26+00:00,0.0,0.0,1.0,0.0
investing,Why I’m Taking Profits on Robinhood (HOOD) After a 70% Run,2025-06-03 14:02:14+00:00,0.4404,0.0,0.775,0.225
investing,Alternatives to Yahoo Finance App or how to disable “Top Stories for You”,2025-06-03 13:41:15+00:00,0.0,0.0,1.0,0.0
investing,401k company match deadline,2025-06-03 12:52:40+00:00,0.0,0.0,1.0,0.0
investing,Plan around 80k insurance limit,2025-06-03 12:35:01+00:00,0.0,0.0,1.0,0.0
investing,What's the most liquid way to invest in gold?,2025-06-03 11:54:18+00:00,0.0,0.0,1.0,0.0
investing,"Daily General Discussion and Advice Thread - June 03, 2025",2025-06-03 09:01:20+00:00,0.0,0.0,1.0,0.0
investing,Health savings account. Advice,2025-06-03 07:19:24+00:00,0.0,0.0,1.0,0.0
investing,Your worst investment so far???,2025-06-03 06:11:00+00:00,-0.6848,0.537,0.463,0.0
investing,I have an ESPP trading sideways. Do I sell it as I acquire it and move it into something else?,2025-06-03 01:44:42+00:00,0.0,0.0,1.0,0.0
investing,PowerOne Corporation or PRHL investor?,2025-06-03 01:01:26+00:00,0.0,0.0,1.0,0.0
investing,Working in finance to learn investing,2025-06-02 23:40:05+00:00,0.0,0.0,1.0,0.0
investing,Advice on my investment plan,2025-06-02 23:05:45+00:00,0.0,0.0,1.0,0.0
investing,Am I too concentrated? REIT Portfolio,2025-06-02 21:39:43+00:00,0.0,0.0,1.0,0.0
investing,Making the Decision Between Paying Down High Rate Mortgage vs. Investing,2025-06-02 20:44:30+00:00,0.0,0.0,1.0,0.0
investing,Capital IQ vs Bloomberg platform,2025-06-02 20:12:46+00:00,0.0,0.0,1.0,0.0
investing,DCA means timing the market?,2025-06-02 19:40:47+00:00,0.0,0.0,1.0,0.0
investing,CDs v. Bonds for the safe portion of a portfolio,2025-06-02 18:16:58+00:00,0.4404,0.0,0.756,0.244
investing,"Is my long-term portfolio too aggressive? Early 20s, DCA’ing $1K/month, Bitcoin bull",2025-06-02 18:06:38+00:00,-0.1531,0.127,0.873,0.0
investing,Thoughts ok Cloudastructure (CSAI)?,2025-06-02 17:57:56+00:00,0.296,0.0,0.577,0.423
investing,Can anyone help me to reassess my portfolio please?,2025-06-02 17:26:58+00:00,0.6124,0.0,0.583,0.417
investing,Need help choosing investing platform,2025-06-02 17:23:56+00:00,0.4019,0.0,0.597,0.403
investing,Hope I did not make the wrong move here. Moved old traditional 401k to Self-Directed Traditional IRA.,2025-06-02 17:23:30+00:00,0.6656,0.0,0.733,0.267
investing,How much cash should you keep in your portfolio to add more in case markets go down?,2025-06-02 16:57:13+00:00,0.0,0.0,1.0,0.0
investing,[INMB] INmune Bio Inc. - High risk/high reward,2025-06-02 13:40:32+00:00,0.5719,0.0,0.654,0.346
investing,"Daily General Discussion and Advice Thread - June 02, 2025",2025-06-02 09:01:31+00:00,0.0,0.0,1.0,0.0
investing,Dual listed stock is losing one listing - what happens?,2025-06-02 07:31:51+00:00,-0.3818,0.224,0.776,0.0
investing,"Section 899 of Trumps BBB, Non-US investors",2025-06-02 05:33:11+00:00,0.0,0.0,1.0,0.0
investing,Does an HYSA make sense for me? Recommendations?,2025-06-02 03:35:47+00:00,0.0,0.0,1.0,0.0
investing,WeBull for IRA and Investments,2025-06-02 00:42:19+00:00,0.0,0.0,1.0,0.0
investing,How to buy Canadian stocks on the Canadian TSX thru Merrill Lynch,2025-06-01 23:44:18+00:00,0.0,0.0,1.0,0.0
investing,Any Downsides of Brokered CDs vs Regular CDs?,2025-06-01 20:10:20+00:00,0.0,0.0,1.0,0.0
investing,Opening a Roth IRA account for my children,2025-06-01 19:08:08+00:00,0.0,0.0,1.0,0.0
investing,"ACOG, the APPROVED Alzheimer's drug company on the market everyone sleeps on",2025-06-01 17:06:01+00:00,0.5473,0.0,0.757,0.243
investing,Internship Paycheck Into S&P or Student Loans? (Opinions),2025-06-01 15:43:09+00:00,0.0,0.0,1.0,0.0
investing,Should I invest a lump sum into my Roth IRA (fidelity) right now or wait until January next year?,2025-06-01 15:25:47+00:00,0.0,0.0,1.0,0.0
investing,Is investing in college a good idea?,2025-06-01 14:56:46+00:00,0.4404,0.0,0.674,0.326
investing,Can someone answer a few questions for me about dividend stocks?,2025-06-01 14:01:14+00:00,0.0,0.0,1.0,0.0
investing,What stocks to invest in long term?,2025-06-01 13:39:16+00:00,0.0,0.0,1.0,0.0
investing,is the CSI 300 a good investment?,2025-06-01 13:25:55+00:00,0.4404,0.0,0.674,0.326
investing,"Invest in small AirBnb property, yes or no?",2025-06-01 11:14:13+00:00,0.4019,0.0,0.722,0.278
investing,Need a bit of a push! Lumb Sum or 50/50?,2025-06-01 10:37:59+00:00,0.0,0.0,1.0,0.0
investing,"Daily General Discussion and Advice Thread - June 01, 2025",2025-06-01 09:01:22+00:00,0.0,0.0,1.0,0.0
investing,Ask Community : ETF investing with a special restriction.,2025-06-01 08:54:34+00:00,0.1531,0.178,0.593,0.229
investing,EU blue chip CAPEX-light non-cyclical stock at below 5x earnings,2025-06-01 06:00:48+00:00,0.0,0.0,1.0,0.0
investing,Retirement and general investing,2025-06-01 05:16:53+00:00,0.0,0.0,1.0,0.0
investing,Which stocks go up and which ones go down,2025-06-01 04:48:52+00:00,0.0,0.0,1.0,0.0
investing,Why doesn’t an ETF exist for the wheel strategy? Selling cash secured puts and covered calls.,2025-06-01 03:47:03+00:00,0.4019,0.0,0.847,0.153
investing,Is anyone else selling off their stocks?,2025-06-01 03:22:19+00:00,0.0,0.0,1.0,0.0
investing,"SCHG, QQQM, or SPMO to pair with SPLG",2025-05-31 19:59:23+00:00,0.0,0.0,1.0,0.0
investing,Why are we told to take less risks in retirement accts?,2025-05-31 14:35:36+00:00,-0.204,0.153,0.847,0.0
investing,Calculating Roth contributions to keep take home pay steady,2025-05-31 14:24:20+00:00,-0.1027,0.149,0.851,0.0
investing,How much money do you need today to survive the transition to an AI economy?,2025-05-31 14:03:09+00:00,0.0,0.0,1.0,0.0
investing,How long does 401k contributions take to be deposited?,2025-05-31 13:12:10+00:00,0.0,0.0,1.0,0.0
investing,The power of compounding and why it isnt as simple as some make it seem,2025-05-31 13:04:17+00:00,0.0,0.0,1.0,0.0
investing,"New job, different investments",2025-05-31 11:18:58+00:00,0.0,0.0,1.0,0.0
investing,"Daily General Discussion and Advice Thread - May 31, 2025",2025-05-31 09:01:26+00:00,0.0,0.0,1.0,0.0
investing,📈 X-ray of the May-25 Rally of the S&P 500: +6.2% to All-Time Highs—Healthy Rise or Technological Mirage?,2025-05-31 06:56:18+00:00,0.0,0.0,1.0,0.0
investing,Why does bond ETF fluctuate in value?,2025-05-31 04:44:51+00:00,0.34,0.0,0.714,0.286
investing,The average P/E ratio of the S&P 500 is quite high. Has there ever been a point in history where this was *not* followed by a crash? (i.e. the earnings caught up with the prices instead),2025-05-31 03:33:56+00:00,-0.4019,0.072,0.928,0.0
investing,What do you think about NVIDIA’s investments? 3 potential stock buys,2025-05-30 23:50:52+00:00,0.0,0.0,1.0,0.0
investing,Weekly investing strategy. Any advice or suggestions?,2025-05-30 23:34:35+00:00,0.0,0.0,1.0,0.0
investing,Proposed U.S. foreign tax bill would make US assets a lot less desirable worldwide.,2025-05-30 22:46:49+00:00,0.4033,0.0,0.764,0.236
investing,Has Anyone Heard of Ashton Gray Developers? Legit or Scam?,2025-05-30 22:44:09+00:00,-0.6199,0.311,0.689,0.0
investing,Rebuild Portfolio Or Keep Paying Student Loans?,2025-05-30 22:32:07+00:00,0.0,0.0,1.0,0.0
investing,Anyone else looking at Vertiv (VRT) as a long-term Al infrastructure play?,2025-05-30 21:23:38+00:00,0.34,0.0,0.821,0.179
investing,What if I put my investments this way?,2025-05-30 20:36:56+00:00,0.0,0.0,1.0,0.0
investing,Do Acc ETFs lose underlying assets over time due to the expense ratio? Is this a long-term concern?,2025-05-30 19:44:11+00:00,-0.3313,0.147,0.771,0.082
investing,Two Roth IRA’s or one Joint Brokerage?,2025-05-30 19:27:26+00:00,0.0,0.0,1.0,0.0
investing,Is FNMA at $10.50 still worth the gamble?,2025-05-30 18:39:05+00:00,0.2263,0.0,0.787,0.213
investing,Where to access the Athens Stock Exchange?,2025-05-30 17:37:36+00:00,0.0,0.0,1.0,0.0
investing,Looking for one or two funds to put my Fidelity HSA into,2025-05-30 14:38:48+00:00,0.0,0.0,1.0,0.0
investing,How does it work investing with dual nationality (US / Spain)?,2025-05-30 13:40:59+00:00,0.0,0.0,1.0,0.0
investing,SGOV manual sell/buy question,2025-05-30 13:40:49+00:00,0.0,0.0,1.0,0.0
investing,"I get emails from analysists like Alex Green, Jim Rickards and the like. They want to sell me ""my book to financial freedom.""",2025-05-30 12:56:27+00:00,0.8591,0.0,0.644,0.356
investing,Are investment research reports for retail investors actually good and useful? Do you actually follow the advice?,2025-05-30 12:35:52+00:00,0.7319,0.0,0.709,0.291
investing,Why won’t the bank take a lower principal balance for my loan?,2025-05-30 11:56:58+00:00,-0.296,0.167,0.833,0.0
investing,"Daily General Discussion and Advice Thread - May 30, 2025",2025-05-30 09:01:31+00:00,0.0,0.0,1.0,0.0
investing,claiming disallowed wash sale?,2025-05-30 08:18:58+00:00,0.0,0.0,1.0,0.0
investing,Seeking advice on my ETF portfolio mix.,2025-05-30 06:37:42+00:00,0.0,0.0,1.0,0.0
investing,Thoughts on shifting some S&P investments into Nifty 500,2025-05-30 05:27:01+00:00,0.4019,0.0,0.748,0.252
investing,Biggest gains from beating the market this year?,2025-05-30 03:46:03+00:00,-0.1531,0.263,0.526,0.211
investing,Question about wash sales,2025-05-30 02:35:09+00:00,0.0,0.0,1.0,0.0
investing,"Sold Hood and started positions in Apple, Google, NVDA today",2025-05-30 01:27:26+00:00,0.0,0.0,1.0,0.0
investing,Suggestions on your favorite growth and dividend growth ETF's.,2025-05-30 00:01:33+00:00,0.802,0.0,0.423,0.577
investing,What companies are going to be around in 50 years?,2025-05-29 23:44:21+00:00,0.0,0.0,1.0,0.0
investing,Large Sum Investing Alternatives,2025-05-29 21:22:46+00:00,0.0,0.0,1.0,0.0
investing,Never been this worried about my Apple holding,2025-05-29 21:02:49+00:00,-0.3612,0.263,0.737,0.0
investing,Appeals Court temporarily stays Trade Court ruling on Trump Tariffs,2025-05-29 20:57:04+00:00,0.0,0.0,1.0,0.0
investing,"Crcl IPO 26$ initial price. Dgnx ran to over 100,Nmax over 200, bull over 70",2025-05-29 19:12:14+00:00,0.0,0.0,1.0,0.0
investing,Roth IRA & Dividends - Thoughts?,2025-05-29 18:42:28+00:00,0.0,0.0,1.0,0.0
investing,"At what age, or perhaps how many years from retirement is it appropriate to start moving your 401K into bonds?",2025-05-29 18:12:10+00:00,0.0,0.0,1.0,0.0
investing,Powell says Fed policy will be based only on objective analysis,2025-05-29 16:57:16+00:00,0.0,0.0,1.0,0.0
investing,Does one's total wealth or assets affect the bond to stock ratio,2025-05-29 16:55:48+00:00,0.6659,0.0,0.647,0.353
investing,Those who track investments daily - what's your setup?,2025-05-29 16:41:41+00:00,0.0,0.0,1.0,0.0
investing,Was the court ruling on tariffs already priced in?,2025-05-29 16:07:13+00:00,0.0,0.0,1.0,0.0
investing,U.S.: International Trade Court strikes down most of Trump’s “Liberation Day” tariffs (29 May 2025),2025-05-29 16:05:38+00:00,-0.3612,0.152,0.848,0.0
investing,Best Asset Allocation for Late Bloomer,2025-05-29 14:35:08+00:00,0.7717,0.0,0.374,0.626
investing,Kickstarting my investing,2025-05-29 14:10:54+00:00,0.0,0.0,1.0,0.0
investing,The indicators are not signalling a recession any time soon,2025-05-29 13:04:30+00:00,0.3252,0.0,0.794,0.206
investing,Has anyone invested in Indonesia? Are there any tax risks?,2025-05-29 09:21:30+00:00,-0.3527,0.215,0.785,0.0
investing,"Daily General Discussion and Advice Thread - May 29, 2025",2025-05-29 09:01:18+00:00,0.0,0.0,1.0,0.0
investing,Semis not recovering despite new wave of AI spending?,2025-05-29 07:45:20+00:00,0.0,0.0,1.0,0.0
investing,Is real estate a way better ROI than stocks like VOO in the long run?,2025-05-29 04:08:56+00:00,0.6597,0.0,0.707,0.293
investing,"Court blocks tariffs,  but we already Severed ties, Fractured relationship",2025-05-29 00:49:43+00:00,-0.5719,0.37,0.63,0.0
investing,"Court strikes down Trump's tariffs, ruling them illegal",2025-05-29 00:34:06+00:00,-0.7269,0.504,0.496,0.0
investing,The Euphoric Blip Before the Storm,2025-05-29 00:23:06+00:00,0.6369,0.0,0.543,0.457
investing,Any books on building wealth through tax breaks?,2025-05-28 23:04:12+00:00,0.4939,0.0,0.686,0.314
investing,"Everyone Sees AI coming, yet",2025-05-28 22:44:13+00:00,0.0,0.0,1.0,0.0
investing,The impact of Big Beautiful Bill on markets,2025-05-28 20:53:34+00:00,0.5994,0.0,0.642,0.358
investing,What’s your opinion on investing with leverage?,2025-05-28 18:46:50+00:00,0.0,0.0,1.0,0.0
investing,Financial advice? Just love no hate🙏,2025-05-28 17:38:22+00:00,0.8019,0.0,0.455,0.545
investing,Reasons for gold going down or crash to zero?,2025-05-28 15:47:17+00:00,-0.4019,0.252,0.748,0.0
investing,Onward Medical: Huge Upward Potential (ONWD:xbru & ONWRF),2025-05-28 11:24:32+00:00,0.3182,0.0,0.753,0.247
investing,Australian looking for thoughts on super,2025-05-28 09:11:21+00:00,0.5994,0.0,0.562,0.438
investing,"Daily General Discussion and Advice Thread - May 28, 2025",2025-05-28 09:01:29+00:00,0.0,0.0,1.0,0.0
investing,Japan 40-year Bond Auction Results,2025-05-28 05:34:06+00:00,0.0,0.0,1.0,0.0
investing,Long term investing: is domestic not good enough?,2025-05-27 22:46:52+00:00,-0.3412,0.256,0.744,0.0
investing,Investments That Mirror Politicians,2025-05-27 19:39:00+00:00,0.0,0.0,1.0,0.0
investing,Diversifying into international,2025-05-27 16:54:25+00:00,0.0,0.0,1.0,0.0
investing,Should I pick an ETF with lower expense ratio but trades in USD or higher expense ratio but trades in CAD?,2025-05-27 16:38:05+00:00,-0.1531,0.074,0.926,0.0
investing,Is the market too shortsighted or am I being too cautious?,2025-05-27 16:24:36+00:00,-0.1027,0.123,0.877,0.0
investing,Growth stock for 5-10 yr outlook?,2025-05-27 16:23:51+00:00,0.3818,0.0,0.658,0.342
investing,What is your honest opinion on Wealth Management servies offerred by big banks?,2025-05-27 16:07:02+00:00,0.7579,0.0,0.629,0.371
investing,Anyone switch from Fidelity to a different brokerage? Why?,2025-05-27 16:00:28+00:00,0.0,0.0,1.0,0.0
investing,NVIDIA Earnings Tomorrow – The Market’s Locomotive Report. Thoughts?,2025-05-27 15:15:46+00:00,0.0,0.0,1.0,0.0
investing,Canada: What incentives are there to transfer to a discount brokerage?,2025-05-27 15:01:06+00:00,0.3182,0.0,0.813,0.187
investing,"Investing in AI with Dell, Nvidia, TSS Inc.",2025-05-27 14:29:58+00:00,0.0,0.0,1.0,0.0
investing,Additional Contributions into Roth IRA or Annuity?,2025-05-27 14:20:01+00:00,0.0,0.0,1.0,0.0
investing,What is your general take on investing in Treasury Bonds at the moment?,2025-05-27 14:07:26+00:00,0.2023,0.0,0.87,0.13
investing,Is an ISA a good idea right now?,2025-05-27 13:51:16+00:00,0.4404,0.0,0.707,0.293
investing,Is Buying Gold the Smartest Move in 2025?,2025-05-27 13:09:26+00:00,0.6124,0.0,0.636,0.364
investing,"Poll: Stocks Fall, Gold Rises; Real Estate Still Best Investment",2025-05-27 12:44:44+00:00,0.6369,0.0,0.682,0.318
investing,TSLA: Why I'm still bullish despite the EPS nosedive,2025-05-27 09:58:01+00:00,0.0,0.0,1.0,0.0
investing,"Daily General Discussion and Advice Thread - May 27, 2025",2025-05-27 09:01:29+00:00,0.0,0.0,1.0,0.0
investing,TQQQ vs QQQ confused about why not to pick TQQQ,2025-05-27 07:38:10+00:00,-0.3182,0.204,0.796,0.0
investing,I’m getting an inheritance of roughly around $350000 Aud and I want to invest it,2025-05-27 05:00:41+00:00,0.0772,0.0,0.915,0.085
investing,Follow-up to previous 401(k) fees post - List of offerings,2025-05-27 04:23:30+00:00,0.0,0.0,1.0,0.0
investing,Inheritance incoming. Need help.,2025-05-27 04:01:23+00:00,0.4019,0.0,0.526,0.474
investing,Investing advice needed...no experience,2025-05-27 03:29:50+00:00,0.0,0.0,1.0,0.0
investing,What are the most heavily watered stocks you've come across in your investing ?,2025-05-27 03:24:20+00:00,0.0,0.0,1.0,0.0
investing,"What options 401k owners have if national debt blows up like Greek, etc",2025-05-27 00:49:14+00:00,0.0,0.156,0.688,0.156
investing,RDDT's valued at only 1% of META's worth Now,2025-05-26 19:18:01+00:00,0.5859,0.0,0.593,0.407
investing,Portfolio diversification,2025-05-26 18:09:00+00:00,0.0,0.0,1.0,0.0
