subreddit,title,created_utc,compound,neg,neu,pos
StockMarket,"Exclusive: China issues rare earth licenses to suppliers of top 3 US automakers, sources say",2025-06-06 15:33:58+00:00,0.3182,0.0,0.798,0.202
StockMarket,META is the best performing mega cap stock YTD.  Which ticker do you think will perform best for the remainder of the year?,2025-06-06 15:04:53+00:00,0.8555,0.0,0.714,0.286
StockMarket,BLS June - Jobs revised lower for March and April,2025-06-06 14:12:12+00:00,-0.296,0.196,0.804,0.0
StockMarket,"At this point, either the Fed gets pressured into cutting rates at the next meeting, or Trump is going to make a Hail Mary attempt to fire Powell to make a statement",2025-06-06 13:57:06+00:00,-0.5423,0.165,0.798,0.037
StockMarket,"(06/6) Trump, TSLA, IPOs, and Rockets! Interesting Stocks Today.",2025-06-06 13:15:48+00:00,0.4574,0.0,0.728,0.272
StockMarket,Trump is not interested in ending his feud with Musk,2025-06-06 13:15:16+00:00,-0.5659,0.368,0.632,0.0
StockMarket,"Daily General Discussion and Advice Thread - June 06, 2025",2025-06-06 09:01:24+00:00,0.0,0.0,1.0,0.0
StockMarket,"Scott Besant, Howard Lutnick, and Jamison Greer Three U.S. Cabinet officials at one point in the trade talks with Japan put the talks on hold and started a debate in front of Japanese negotiators",2025-06-06 06:16:16+00:00,0.0,0.0,1.0,0.0
StockMarket,Large-Cap U.S. Companies by Net Income,2025-06-06 04:23:39+00:00,0.0,0.0,1.0,0.0
StockMarket,Walmart plans to expand drone deliveries to three more states,2025-06-05 22:10:02+00:00,0.3182,0.0,0.796,0.204
StockMarket,UK Vehicle Production Slumps to Historic Low as Industry Faces Structural Challenges,2025-06-05 20:54:02+00:00,-0.2023,0.157,0.746,0.097
StockMarket,Tesla erases nearly all post-election gains,2025-06-05 20:16:38+00:00,0.34,0.0,0.676,0.324
StockMarket,Tesla drops 13%+ as Musk-Trump feud erupts over EV mandate cuts and spending bill,2025-06-05 19:06:01+00:00,-0.5574,0.277,0.723,0.0
StockMarket,"U.S. TREASURY JUST BOUGHT BACK $10 BILLION OF ITS OWN DEBT, THE LARGEST BUYBACK IN HISTORY",2025-06-05 16:16:31+00:00,-0.1779,0.164,0.708,0.128
StockMarket,Energy Transfer says US government requiring licenses to export ethane to China,2025-06-05 15:38:15+00:00,0.2732,0.0,0.84,0.16
StockMarket,"Goodbye to 8,000 jobs - IBM replaces workers with artificial intelligence, sparking a wave of global reactions",2025-06-05 15:19:21+00:00,0.4767,0.0,0.838,0.162
StockMarket,Breaking | Trump and Xi break months-long stand-off with a phone call,2025-06-05 13:21:42+00:00,0.0,0.0,1.0,0.0
StockMarket,European Central Bank trims interest rate after inflation falls below target,2025-06-05 12:57:12+00:00,0.4588,0.0,0.769,0.231
StockMarket,"The iShares Defense Industrials Active ETF (IDEF) is the BEST, most diversified defense sector ETF available, is actively managed, has the most robust and niche holdings unavailable in other defense ETFs. Read on for my assessment why if you are into defense, this should not be slept on.",2025-06-05 12:32:21+00:00,0.9423,0.0,0.679,0.321
StockMarket,"$LIN in times of news induced volatility can be a good stock, imo",2025-06-05 09:43:18+00:00,0.4404,0.0,0.805,0.195
StockMarket,"Daily General Discussion and Advice Thread - June 05, 2025",2025-06-05 09:01:07+00:00,0.0,0.0,1.0,0.0
StockMarket,Shiny Rocks Not Stocks - Financial Repression and the Bull Case for Metals,2025-06-04 22:06:31+00:00,-0.3818,0.178,0.822,0.0
StockMarket,Has there ever been another stock chart that played out like this?,2025-06-04 22:05:19+00:00,0.5994,0.0,0.671,0.329
StockMarket,Tesla May sales fall in big European markets ahead of new Model Y deliveries,2025-06-04 21:51:39+00:00,0.0,0.0,1.0,0.0
StockMarket,"Fed 'Beige Book' economic report cites declining growth, rising prices and slow hiring",2025-06-04 18:59:24+00:00,0.3818,0.0,0.822,0.178
StockMarket,Apple ($AAPL) stock forms 'death cross',2025-06-04 17:50:02+00:00,-0.5994,0.438,0.562,0.0
StockMarket,Tesla shows no sign of improvement in May sales data,2025-06-04 17:08:54+00:00,0.2023,0.167,0.606,0.227
StockMarket,WSJ - Several traditional and EV makers are considering shifting some parts manufacturing to China,2025-06-04 15:40:13+00:00,0.0,0.0,1.0,0.0
StockMarket,"OECD forecasts a sharp economic slowdown and higher inflation in the U.S., citing tariffs",2025-06-04 15:12:50+00:00,0.0,0.0,1.0,0.0
StockMarket,"Dollar Tree expects to take profit hit from tariffs, shares drop on outlook",2025-06-04 14:37:17+00:00,0.4588,0.122,0.581,0.297
StockMarket,"Non-Manufacturing PMI dips below expectations, signaling contraction in sector",2025-06-04 14:11:17+00:00,0.0,0.0,1.0,0.0
StockMarket,Steel tariffs set to double today,2025-06-04 13:58:37+00:00,0.0,0.0,1.0,0.0
StockMarket,"European auto suppliers shut plants as China blocks rare earth flow, association says",2025-06-04 11:39:00+00:00,-0.2263,0.137,0.863,0.0
StockMarket,"US major automakers manufacturers, fearful they will have to shut down assembly lines, consider moving some parts production to China",2025-06-04 11:21:24+00:00,-0.5367,0.154,0.846,0.0
StockMarket,"Daily General Discussion and Advice Thread - June 04, 2025",2025-06-04 09:00:54+00:00,0.0,0.0,1.0,0.0
StockMarket,Ford Accelerates Forward with 16% Sales Surge in May 2025,2025-06-04 08:37:32+00:00,0.0,0.0,1.0,0.0
StockMarket,What If The Inflation Fight Is Already Lost?,2025-06-04 04:50:05+00:00,-0.5994,0.45,0.55,0.0
StockMarket,Apparently there's still time to buy the dip! Market up 10% by end of year.,2025-06-04 02:38:42+00:00,0.0,0.0,1.0,0.0
StockMarket,Samsung could drop Google Gemini in favor of Perplexity for Galaxy S26,2025-06-03 23:23:56+00:00,0.1531,0.142,0.676,0.182
StockMarket,CrowdStrike shares drop on weak revenue guidance,2025-06-03 22:37:24+00:00,-0.4215,0.446,0.357,0.196
StockMarket,"AI startups revolutionize coding industry, leading to sky-high valuations",2025-06-03 21:46:42+00:00,0.0,0.0,1.0,0.0
StockMarket,Trump Administration Live Updates: Musk Calls Trump’s Signature Bill an ‘Abomination’ That Will Swell Deficit,2025-06-03 18:51:25+00:00,-0.4019,0.162,0.838,0.0
StockMarket,Question about buying stocks at a certain vs when finally receiving the said stocks. Will I profit from it?,2025-06-03 17:30:46+00:00,0.6124,0.0,0.773,0.227
StockMarket,"Dollar General (NYSE: DG) is shaking off tariff fears and winning over higher-income consumers, raised its full-year forecast after beating first-quarter expectations",2025-06-03 15:55:04+00:00,-0.4767,0.26,0.623,0.118
StockMarket,"Ford reports 16% sales increase in May amid employee pricing, tariffs",2025-06-03 14:24:31+00:00,0.3182,0.0,0.813,0.187
StockMarket,Bristol Myers makes $11 billion deal with BioNTech to join the cancer-drug race,2025-06-03 09:09:33+00:00,0.296,0.0,0.845,0.155
StockMarket,"Daily General Discussion and Advice Thread - June 03, 2025",2025-06-03 09:01:07+00:00,0.0,0.0,1.0,0.0
StockMarket,Tesla bounces back with highest Australian sales in nearly 12 months,2025-06-03 06:13:23+00:00,0.0,0.0,1.0,0.0
StockMarket,Tesla's sale in Norway rises 213% year-on-year in May,2025-06-03 05:10:01+00:00,0.0,0.0,1.0,0.0
StockMarket,Exail Technologies has joined the U.S. OTCQX,2025-06-03 01:20:22+00:00,0.0,0.0,1.0,0.0
StockMarket,Exclusive: US pushes countries for best offers by Wednesday as tariff deadline looms,2025-06-03 01:02:10+00:00,0.6249,0.092,0.578,0.329
StockMarket,This is what a tweet based economy does to a stock market. (27 year long graph),2025-06-02 23:01:43+00:00,0.0,0.0,1.0,0.0
StockMarket,Alphabet stock could fall as much as 25% in 'black swan event' if judge orders Google Chrome divestiture,2025-06-02 22:12:28+00:00,0.0,0.0,1.0,0.0
StockMarket,Debt is Higher and Rising Faster in 80 Percent of Global Economy,2025-06-02 20:49:36+00:00,-0.3612,0.185,0.815,0.0
StockMarket,China says U.S. violated tariff truce as trade war heats up,2025-06-02 20:14:30+00:00,-0.8074,0.448,0.552,0.0
StockMarket,"Ford Focus production ends in November- While the Focus does still find about 100,000 abroad each year",2025-06-02 18:44:08+00:00,0.0,0.0,1.0,0.0
StockMarket,The market is incapable of falling. Who keeps buying the dip?,2025-06-02 16:57:18+00:00,-0.4939,0.318,0.682,0.0
StockMarket,Truist initiates coverage on Payments/FinTech stocks,2025-06-02 14:01:12+00:00,0.0,0.0,1.0,0.0
StockMarket,"Ray Dalio always predicts financial crises,  but it never happens…",2025-06-02 13:38:17+00:00,0.0,0.0,1.0,0.0
StockMarket,Dow Futures Fall; China Says U.S. Has 'Seriously Undermined' Trade Truce,2025-06-02 11:14:33+00:00,-0.4939,0.318,0.682,0.0
StockMarket,"Daily General Discussion and Advice Thread - June 02, 2025",2025-06-02 09:01:42+00:00,0.0,0.0,1.0,0.0
StockMarket,US Car makers warn China's rare-earth curbs could halt production,2025-06-02 01:04:06+00:00,-0.1027,0.135,0.865,0.0
StockMarket,Anthropic CEO warns AI will destroy half of all white-collar jobs,2025-06-02 00:25:14+00:00,-0.5994,0.353,0.647,0.0
StockMarket,Europe’s Stocks Dominate World Markets as US Trade War Backfires,2025-06-01 19:23:03+00:00,-0.6597,0.403,0.597,0.0
StockMarket,Bullish on SPY,2025-06-01 14:34:11+00:00,0.0,0.0,1.0,0.0
StockMarket,"Daily General Discussion and Advice Thread - June 01, 2025",2025-06-01 09:01:09+00:00,0.0,0.0,1.0,0.0
StockMarket,"Big BYD dealer in eastern China goes out of business, local media reports",2025-06-01 01:38:03+00:00,0.0,0.0,1.0,0.0
StockMarket,"Spy candle coming June - The market won't be going up, No  China deal, Japan deal, or Euro deal. Tensions with China and Taiwan only add to the uncertainty.""",2025-06-01 01:22:21+00:00,-0.743,0.219,0.781,0.0
StockMarket,I don't think the the market will be able to ignore everything that the US is doing for much longer,2025-05-31 22:02:04+00:00,-0.3612,0.116,0.884,0.0
StockMarket,Bond auction shows Trump’s economic house of cards may soon collapse,2025-05-31 20:14:21+00:00,-0.4939,0.242,0.758,0.0
StockMarket,Week & Month Recap: The week and month closed positively. Core PCE inflation decreased. This May was the best-performing May since 1990.,2025-05-31 19:40:25+00:00,0.5267,0.0,0.861,0.139
StockMarket,Tarrifs are a reaction not the cause - Americas silent depression,2025-05-31 18:01:26+00:00,-0.5719,0.27,0.73,0.0
StockMarket,I think SMCI has a double bottom forming into a cup and handle (Rookie),2025-05-31 13:30:21+00:00,0.0,0.0,1.0,0.0
StockMarket,"Daily General Discussion and Advice Thread - May 31, 2025",2025-05-31 09:01:02+00:00,0.0,0.0,1.0,0.0
StockMarket,Stocks finish lower but notch strong monthly gain despite tariff worries | Reuters,2025-05-31 06:26:26+00:00,0.909,0.071,0.397,0.532
StockMarket,Trump says U.S. will double steel tariffs to 50%,2025-05-30 22:12:30+00:00,0.0,0.0,1.0,0.0
StockMarket,"Exclusive-China magnet pinch threatens car production, automakers warn",2025-05-30 20:12:42+00:00,-0.4588,0.4,0.6,0.0
StockMarket,"Inflation rate slipped to 2.1% in April, lower than expected.",2025-05-30 12:46:29+00:00,-0.296,0.196,0.804,0.0
StockMarket,Section 899 of the Big Billious Tax BIll,2025-05-30 12:43:33+00:00,0.0,0.0,1.0,0.0
StockMarket,India's economy grew by faster than expected 7.4% in the March quarter,2025-05-30 11:06:41+00:00,0.0,0.0,1.0,0.0
StockMarket,"Daily General Discussion and Advice Thread - May 30, 2025",2025-05-30 09:01:11+00:00,0.0,0.0,1.0,0.0
StockMarket,The Global Dow which includes the US:  you show the market pulled back and then shot higher into the all time high in 2007. The same event just occurred now on the same magnitude .,2025-05-30 05:08:56+00:00,0.0,0.0,1.0,0.0
StockMarket,"SP500 now up from when Trump won the election; 40 days to tariff unpause still looms, however",2025-05-30 01:44:50+00:00,0.4767,0.079,0.739,0.182
StockMarket,"After Court Blocks Trump’s Tariffs, America’s Trading Partners Weigh Next Moves",2025-05-30 00:25:14+00:00,-0.2263,0.16,0.84,0.0
StockMarket,"Trump summons Fed's Powell, tells him he's making a mistake on rates",2025-05-29 22:12:37+00:00,-0.34,0.179,0.821,0.0
StockMarket,Costco tops earnings and revenue estimates as sales jump 8%,2025-05-29 20:57:19+00:00,0.5106,0.0,0.732,0.268
StockMarket,'Buy the dip' is back,2025-05-29 20:35:38+00:00,0.0,0.0,1.0,0.0
StockMarket,Second federal court blocks Trump’s tariffs,2025-05-29 20:02:26+00:00,-0.2263,0.275,0.725,0.0
StockMarket,Omada Health aims to go public with market cap of up to $1.1 billion (Nasdaq: OMDA expected share price of ~$19 per share),2025-05-29 18:21:28+00:00,0.5267,0.0,0.827,0.173
StockMarket,"Trump's tariff tally: $34 billion and counting, global companies say",2025-05-29 16:37:08+00:00,0.0,0.0,1.0,0.0
StockMarket,"Boeing to resume airplane deliveries to China next month, ramp up Max production, CEO says",2025-05-29 14:58:15+00:00,0.0,0.0,1.0,0.0
StockMarket,Arista Network and Vertiv : bad news ?,2025-05-29 14:55:44+00:00,-0.5423,0.333,0.667,0.0
StockMarket,"Best Buy cuts profit outlook due to tariffs, says it already hiked some prices",2025-05-29 14:40:09+00:00,0.7096,0.108,0.542,0.35
StockMarket,NVIDIA CEO Huang said these four positive surprises are ’turbocharging’ AI growth,2025-05-29 14:29:03+00:00,0.7964,0.0,0.526,0.474
StockMarket,US economy shrank at 0.2% rate in first quarter,2025-05-29 13:52:09+00:00,0.0,0.0,1.0,0.0
StockMarket,Carvana，Scam or Bubble?,2025-05-29 13:45:42+00:00,0.0,0.0,1.0,0.0
StockMarket,Uber stock down after Waymo announcement,2025-05-29 13:43:07+00:00,0.0,0.0,1.0,0.0
StockMarket,(05/29) Tariffs and Teslas and Takeovers!,2025-05-29 13:18:18+00:00,0.0,0.0,1.0,0.0
StockMarket,Breaking News: Trump's Tariff Refund Could Cost US $10 Billion With 2% Month-End Rebalance Impact On Equities In Case Of An Appeal: 'Uncertainty Is Back Front And Center',2025-05-29 13:06:50+00:00,-0.34,0.082,0.918,0.0
StockMarket,Four tools at the Trump administration’s disposal after a U.S. court blocks tariffs,2025-05-29 11:06:05+00:00,-0.2263,0.137,0.863,0.0
StockMarket,Xiaomi's Tesla Y rival YU7 hits showrooms in Beijing,2025-05-29 09:41:54+00:00,0.0,0.0,1.0,0.0
StockMarket,US trade court blocks Trump's sweeping tariffs. What happens now?,2025-05-29 09:20:46+00:00,-0.2263,0.174,0.826,0.0
StockMarket,"Daily General Discussion and Advice Thread - May 29, 2025",2025-05-29 09:00:53+00:00,0.0,0.0,1.0,0.0
StockMarket,Deepseek unveils updates to R1 model,2025-05-29 05:37:42+00:00,0.0,0.0,1.0,0.0
StockMarket,"Asian markets climb, US Futures rise after trade court blocks Trump's sweeping tariffs",2025-05-29 05:21:04+00:00,-0.2263,0.137,0.863,0.0
StockMarket,Why does everyone love NVDA but nobody cares about AMD?,2025-05-29 03:12:48+00:00,0.765,0.0,0.548,0.452
StockMarket,Hong Kong Bankers on Edge Over $11 Billion New World Refinancing,2025-05-29 02:42:20+00:00,0.0,0.0,1.0,0.0
StockMarket,Best Brokerage for Easy Do Not Exercise Instruction Placement/Contract Lapse,2025-05-29 00:26:22+00:00,0.7964,0.0,0.53,0.47
StockMarket,(NYSE: ELF) E.l.f. Beauty to acquire Hailey Bieber skincare brand Rhode in deal valued up to $1 billion,2025-05-28 23:36:58+00:00,0.7717,0.0,0.705,0.295
StockMarket,Court says Trump doesn't have the authority to set tariffs,2025-05-28 23:19:38+00:00,-0.0572,0.12,0.88,0.0
StockMarket,I think the Court of International Trade just overturned the emergency tariffs,2025-05-28 23:17:25+00:00,-0.3818,0.191,0.809,0.0
StockMarket,Tesla investors demand Musk work 40-hour week at EV maker as 'crisis' builds,2025-05-28 22:11:38+00:00,-0.6808,0.337,0.663,0.0
StockMarket,Nvidia revenue growth moderates to slowest pace in 2 years,2025-05-28 21:31:33+00:00,0.3818,0.0,0.776,0.224
StockMarket,GM to invest $888 million in Tonawanda Propulsion plant,2025-05-28 20:45:57+00:00,0.0,0.0,1.0,0.0
StockMarket,Trump orders U.S. firms to halt chip software sales to China,2025-05-28 19:43:19+00:00,0.0,0.0,1.0,0.0
StockMarket,Based on 2024 revenue data… P/E ratio is 198.91 vs 24.7 as of today btw.,2025-05-28 14:27:53+00:00,0.0,0.0,1.0,0.0
StockMarket,Spotlight back on Nvidia,2025-05-28 13:13:33+00:00,0.0,0.0,1.0,0.0
StockMarket,"GameStop shares rise as retailer meme stock buys first bitcoin batch, scooping up $500 million",2025-05-28 12:26:49+00:00,0.296,0.0,0.864,0.136
StockMarket,"Daily General Discussion and Advice Thread - May 28, 2025",2025-05-28 09:00:55+00:00,0.0,0.0,1.0,0.0
StockMarket,Not as bad right?,2025-05-28 05:46:32+00:00,0.431,0.0,0.513,0.487
StockMarket,Is this A.I. doing or are Analysts really overrated?,2025-05-28 01:37:22+00:00,0.0,0.0,1.0,0.0
StockMarket,"Canada Pension Plan Investment Board Piles Into US Despite  ""Buy Canada"" pressure",2025-05-28 00:56:56+00:00,0.2235,0.0,0.854,0.146
StockMarket,$SPY Breakout or Fakeout? Key Levels and Indicators to Watch Into June,2025-05-28 00:19:12+00:00,0.0,0.0,1.0,0.0
StockMarket,"Trump says he’ll take Fannie Mae and Freddie Mac public, keep implicit government guarantees",2025-05-27 22:30:10+00:00,0.0,0.0,1.0,0.0
StockMarket,"Okta shares plunge 11% as company maintains guidance, citing macroeconomic uncertainties",2025-05-27 21:50:59+00:00,-0.0516,0.176,0.662,0.162
StockMarket,"Rocket Lab Enters Payload Market with Agreement to Acquire Geost, Positioning Itself as Disruptive Prime to U.S. National Security",2025-05-27 21:33:03+00:00,0.5106,0.096,0.669,0.234
StockMarket,"23andMe to delist from Nasdaq, deregister with SEC",2025-05-27 19:44:18+00:00,0.0,0.0,1.0,0.0
StockMarket,"Trump says he was ""extremely satisfied"" with the 50% EU tariff",2025-05-27 14:23:17+00:00,0.4754,0.0,0.764,0.236
StockMarket,Stocks set to surge after Trump resets E.U. tariff deadline,2025-05-27 13:11:37+00:00,0.0,0.0,1.0,0.0
StockMarket,My 3 truisms of late,2025-05-27 12:32:03+00:00,0.0,0.0,1.0,0.0
StockMarket,Tesla’s stock price keep rising,2025-05-27 11:33:16+00:00,0.0,0.0,1.0,0.0
StockMarket,"Daily General Discussion and Advice Thread - May 27, 2025",2025-05-27 09:01:08+00:00,0.0,0.0,1.0,0.0
StockMarket,Trump wipes US$1 billion off Russian stock market in a few hours,2025-05-26 23:25:28+00:00,0.0,0.0,1.0,0.0
StockMarket,"Tesla Full Self-Driving veers off road, flips car in scary crash driver couldn't prevent",2025-05-26 22:56:43+00:00,-0.7162,0.388,0.612,0.0
StockMarket,EU trade negotiator says he’s had ‘good calls’ with U.S. after Trump extends tariff deadline,2025-05-26 22:30:14+00:00,0.128,0.0,0.903,0.097
StockMarket,Is it me or the American stock market is dragging the world economy?,2025-05-26 22:29:58+00:00,0.0,0.0,1.0,0.0
StockMarket,China auto shares sink after BYD offers trade-in incentives,2025-05-26 21:20:06+00:00,0.5423,0.0,0.609,0.391
StockMarket,Apple Stock Is On An 8-Day Losing Streak As Trump Trade Fracas Intensifies—Watch These Levels,2025-05-26 20:47:02+00:00,-0.3818,0.157,0.843,0.0
StockMarket,6 charts that capture Nvidia's AI-fueled rise,2025-05-26 19:48:24+00:00,0.0,0.0,1.0,0.0
StockMarket,Nvidia (NVDA) to Help Build Sweden’s First AI Infrastructure,2025-05-26 18:26:44+00:00,0.4019,0.0,0.748,0.252
StockMarket,China’s BYD sees shares plunge 8% as EV maker cuts prices,2025-05-26 18:07:08+00:00,0.0,0.164,0.672,0.164
StockMarket,"Volvo Cars to cut 3,000 jobs globally amid cost-cutting efforts and industry challenges",2025-05-26 14:58:38+00:00,-0.2023,0.146,0.764,0.09
StockMarket,Markets stage relief rally after EU imports tariff is delayed until July 9,2025-05-26 14:06:06+00:00,0.296,0.119,0.688,0.194
StockMarket,European stocks are rising sharply !,2025-05-26 11:24:20+00:00,0.0,0.0,1.0,0.0
StockMarket,"Daily General Discussion and Advice Thread - May 26, 2025",2025-05-26 09:02:00+00:00,0.0,0.0,1.0,0.0
StockMarket,"McDonald’s is closing down CosMc’s, its beverage-focused spinoff",2025-05-26 07:42:34+00:00,0.0,0.0,1.0,0.0
StockMarket,"Ex-Gov't Foe Joins Trump, RFK Jr.'s HHS To Lead Psychedelics Policy: What It Means For Investors",2025-05-26 03:34:09+00:00,-0.4404,0.162,0.838,0.0
StockMarket,announce tariffs fold repeat,2025-05-25 23:21:11+00:00,0.0,0.0,1.0,0.0
StockMarket,Trump pauses EU Tariffs till 7/9.,2025-05-25 22:30:52+00:00,0.0,0.0,1.0,0.0
StockMarket,"Trump grants EU extension to July 9, 2025, on 50% trade tariff after call from European Commission President",2025-05-25 22:23:21+00:00,0.2263,0.0,0.899,0.101
StockMarket,Oracle to spend $40 billion on Nvidia chips for OpenAI data center - FT,2025-05-25 22:17:19+00:00,0.0,0.0,1.0,0.0
StockMarket,"Pivoting From Tax Cuts to Tariffs, Trump Ignores Economic Warning Signs",2025-05-25 20:54:26+00:00,-0.6908,0.456,0.544,0.0
StockMarket,Anyone noticed the obvious demeanor change in Scott Bessent ? Now vs. a year ago interviews,2025-05-25 15:55:18+00:00,0.0,0.0,1.0,0.0
StockMarket,Why investors are calling Trump’s bluff on 50% tariffs on the European Union,2025-05-25 13:30:56+00:00,0.0,0.0,1.0,0.0
StockMarket,"What To Expect in the Markets This Week: May 27–30, 2025",2025-05-25 13:16:19+00:00,0.0,0.0,1.0,0.0
StockMarket,These companies will raise prices because of Trump’s tariffs,2025-05-25 10:10:02+00:00,0.0,0.0,1.0,0.0
StockMarket,"Daily General Discussion and Advice Thread - May 25, 2025",2025-05-25 09:01:30+00:00,0.0,0.0,1.0,0.0
StockMarket,I can't hahaha,2025-05-24 20:12:48+00:00,-0.4449,0.594,0.406,0.0
StockMarket,"Week Recap: The S&P 500 has started a losing streak and reached 4-day. It showed strong momentum in May, but that trend has been broken this week. Will the decline continue? May. 19, 2025 – May 23, 2025",2025-05-24 18:13:08+00:00,-0.5574,0.137,0.785,0.077
StockMarket,Tim Cook’s only idea ever - stock buy backs,2025-05-24 17:36:19+00:00,-0.0516,0.13,0.87,0.0
StockMarket,Trump's permanent revolution of chaos carries cost,2025-05-24 17:12:03+00:00,-0.5719,0.381,0.619,0.0
StockMarket,Trump says he’s ‘not looking for a deal’ with the EU after threatening a 50% tariff,2025-05-24 15:30:48+00:00,-0.5267,0.185,0.815,0.0
StockMarket,"Trump Risks US Consumer Discontent With His Tariffs, Poll Shows",2025-05-24 12:03:45+00:00,-0.2732,0.189,0.811,0.0
StockMarket,China equips Hong Kong with ‘toolbox’ to propel yuan amid de-dollarisation,2025-05-24 10:56:54+00:00,0.0,0.0,1.0,0.0
StockMarket,"Daily General Discussion and Advice Thread - May 24, 2025",2025-05-24 09:01:01+00:00,0.0,0.0,1.0,0.0
StockMarket,U.S. Dollar Falls to Lowest Level Since 2023 After Tariff Threats and Deficit Fears,2025-05-24 08:25:22+00:00,-0.872,0.522,0.478,0.0
StockMarket,I should have posted this yesterday...,2025-05-24 03:24:21+00:00,0.0,0.0,1.0,0.0
StockMarket,"BYD beats Tesla in European EV sales despite EU tariffs in ‘watershed moment,’ report says",2025-05-23 22:56:56+00:00,0.0,0.0,1.0,0.0
StockMarket,Stocks Slide on Deficit and Tariff Concerns,2025-05-23 22:13:54+00:00,-0.4019,0.31,0.69,0.0
StockMarket,Boeing to pay $1.1 billion as part of deal to settle 737 Max crash cases with DOJ,2025-05-23 22:09:33+00:00,-0.4767,0.215,0.785,0.0
StockMarket,Trump says his tariffs on Apple will also apply to Samsung,2025-05-23 20:41:11+00:00,0.0,0.0,1.0,0.0
StockMarket,"Trump claims US Steel will stay in America, create 70,000 jobs in $14B deal with Nippon Steel",2025-05-23 20:07:18+00:00,0.2732,0.0,0.884,0.116
StockMarket,"Wall St falls after Trump threatens steep tariffs on EU, Apple",2025-05-23 16:15:08+00:00,-0.3818,0.206,0.794,0.0
StockMarket,"iPhone could triple in price to $3,500 if they’re made in the US, analyst warns",2025-05-23 15:28:57+00:00,-0.1027,0.091,0.909,0.0
StockMarket,The right half of this graph is honestly wild af,2025-05-23 15:07:20+00:00,0.4588,0.0,0.75,0.25
StockMarket,Goolsbee says Fed now has to wait longer before moving rates because of trade policy uncertainty,2025-05-23 14:03:56+00:00,-0.34,0.138,0.862,0.0
StockMarket,(05/23) Trump Comments Causing Market Volatility! - Interesting Stocks Today,2025-05-23 13:11:30+00:00,0.4574,0.0,0.751,0.249
StockMarket,We are now tariffing individual companies? Maybe the Nasdaq was a little too green.,2025-05-23 12:16:06+00:00,0.0,0.0,1.0,0.0
StockMarket,50% tarrifs on EU June 1st,2025-05-23 11:49:33+00:00,0.0,0.0,1.0,0.0
StockMarket,BofA’s Hartnett Says Buy the Dip in Treasuries as Yields Top 5%,2025-05-23 09:48:55+00:00,0.4019,0.0,0.73,0.27
StockMarket,"Daily General Discussion and Advice Thread - May 23, 2025",2025-05-23 09:01:08+00:00,0.0,0.0,1.0,0.0
StockMarket,The 30yr bond yield looks really bad,2025-05-23 04:59:21+00:00,-0.5849,0.387,0.613,0.0
StockMarket,Japan’s inflation at 3.5 percent is no joke. If the BoJ tightens or defends the yen this may push yields higher fast. The plot thickens.,2025-05-22 23:56:30+00:00,-0.2235,0.073,0.927,0.0
StockMarket,Supreme Court signals Trump can’t fire Fed Chair Powell,2025-05-22 23:50:25+00:00,0.296,0.185,0.538,0.277
StockMarket,US business activity picks up in May from 19-month low in April,2025-05-22 23:42:08+00:00,-0.2732,0.16,0.84,0.0
StockMarket,Supreme Court grants Trump request to fire independent agency members but says Federal Reserve is different,2025-05-22 23:37:39+00:00,0.2617,0.092,0.705,0.203
StockMarket,"Stock futures tick higher as investors try to look past economic worries, deficit fears",2025-05-22 22:34:16+00:00,-0.8074,0.43,0.57,0.0
StockMarket,Trump threatens to limit imports if countries don't pay more for drugs,2025-05-22 22:14:46+00:00,-0.3191,0.187,0.72,0.093
StockMarket,"Why the bond market is so worried about the ‘Big, Beautiful Bill’",2025-05-22 21:42:23+00:00,0.2579,0.171,0.596,0.233
StockMarket,Markets Waver Amid Fiscal Concerns and Rising Yields: Is This the Calm Before the Storm?,2025-05-22 18:21:13+00:00,0.3182,0.0,0.859,0.141
StockMarket,Solar stocks plunge as Republican tax bill worse than feared for clean energy,2025-05-22 17:14:06+00:00,-0.3612,0.313,0.448,0.239
StockMarket,Sold Everything,2025-05-22 17:04:46+00:00,0.0,0.0,1.0,0.0
StockMarket,Google faces antitrust investigation over deal for AI-fueled chatbots,2025-05-22 16:18:03+00:00,0.0,0.0,1.0,0.0
StockMarket,"Senate Votes to End California Gas-Car Ban, Sends Bill to Trump - TSLA: Another bunch of calls?",2025-05-22 15:21:17+00:00,-0.5574,0.184,0.816,0.0
StockMarket,S&P 500 Dips as Trump’s Tax Bill Narrowly Passes House,2025-05-22 14:29:26+00:00,0.0,0.0,1.0,0.0
