subreddit,title,created_utc,compound,neg,neu,pos
Economics,BMW Group Reaches Milestone: Three-Millionth Electrified Vehicle Produced in Munich,2025-05-27 23:24:52+00:00,0.0516,0.0,0.882,0.118
Economics,The Car: A Literal Steel Trap,2025-05-27 22:44:13+00:00,-0.3182,0.315,0.685,0.0
Economics,"Trade Crime Is Soaring, U.S. Firms Say, as Trump’s Tariffs Incentivize Fraud",2025-05-27 22:12:05+00:00,-0.8074,0.422,0.578,0.0
Economics,US Poised to Receive Golden Share in US Steel-Nippon Tie-Up,2025-05-27 21:45:34+00:00,0.4939,0.0,0.656,0.344
Economics,Economic warning sign: Tinned fish sales are on the rise,2025-05-27 19:29:07+00:00,-0.34,0.211,0.789,0.0
Economics,Trump claims victory over EU in 50 percent tariff standoff,2025-05-27 17:53:38+00:00,0.0,0.0,1.0,0.0
Economics,America’s rising ‘moron premium’: Trump’s mercurial war on economic orthodoxy is making markets jittery,2025-05-27 17:43:17+00:00,-0.5994,0.231,0.769,0.0
Economics,"Cox Automotive Forecast: May New-Vehicle Sales To Cool After Tariff-Fueled Surge, 16M SAAR Expected",2025-05-27 17:08:39+00:00,0.3182,0.0,0.85,0.15
Economics,US Consumer Confidence Partially Rebounds in May (Conference Board),2025-05-27 16:55:25+00:00,0.5106,0.0,0.708,0.292
Economics,The Fed Economist Accused of Espionage for Beijing,2025-05-27 16:41:52+00:00,-0.296,0.239,0.761,0.0
Economics,"About 1 in 4 Americans are ""functionally unemployed,"" researcher says",2025-05-27 16:23:23+00:00,0.0,0.0,1.0,0.0
Economics,EU Commission in a hurry on super-computing quantum strategy,2025-05-27 15:51:59+00:00,0.0,0.0,1.0,0.0
Economics,Apple's iPhone exports from India to US jumped 76% in April,2025-05-27 15:03:10+00:00,0.0,0.0,1.0,0.0
Economics,US consumer confidence rebounds after five straight months of declines amid tariff anxiety,2025-05-27 14:42:06+00:00,0.5423,0.101,0.592,0.308
Economics,Trump hails 'positive' step in U.S.-EU trade negotiations as markets hope for a deal,2025-05-27 14:21:34+00:00,0.7579,0.0,0.649,0.351
Economics,How the Student Loan Crisis Will Show Up in the Economy,2025-05-27 12:52:17+00:00,-0.6249,0.291,0.709,0.0
Economics,Economic warning sign: Tinned fish sales are on the rise,2025-05-27 12:30:18+00:00,-0.34,0.211,0.789,0.0
Economics,Tesla Europe sales plummeted by 52% in April — trade group,2025-05-27 12:22:21+00:00,0.0,0.0,1.0,0.0
Economics,"Chinese-owned Volvo Cars to cut 3,000 jobs",2025-05-27 12:06:53+00:00,-0.2732,0.259,0.741,0.0
Economics,Ghost of money — Thomas Jefferson,2025-05-27 11:29:03+00:00,-0.3182,0.315,0.685,0.0
Economics,"German economy expected to contract by 0.3% this year, DIHK says",2025-05-27 11:10:00+00:00,0.0,0.0,1.0,0.0
Economics,"As Trump reignites a trade war and faces a bond market revolt, the economy is about to go through the wringer this week",2025-05-27 10:51:13+00:00,-0.5994,0.151,0.849,0.0
Economics,"Top US, EU chiefs in ‘constant contact’ after Trump tariff reprieve.",2025-05-27 08:21:39+00:00,0.2023,0.0,0.847,0.153
Economics,The case for a stronger yuan.,2025-05-27 08:11:56+00:00,0.3818,0.0,0.658,0.342
Economics,China’s Soft Spot in Trade War With Trump: Risk of Huge Job Loss,2025-05-27 04:29:13+00:00,-0.7184,0.423,0.459,0.117
Economics,AI Powered Economic American Dream Tracker,2025-05-26 22:11:04+00:00,0.25,0.0,0.714,0.286
Economics,"Demographic crisis: Aging EU population relies on immigration, with Italy leading the decline",2025-05-26 22:01:02+00:00,-0.6249,0.255,0.745,0.0
Economics,Trump’s Trade War Sends Chill Through Southern California Port Economy,2025-05-26 20:31:12+00:00,-0.5994,0.302,0.698,0.0
Economics,"Businesses are finding a workaround to minimize the most significant hit from tariffs, using a decades-old piece of legislation known as the “first sale rule.”",2025-05-26 20:13:41+00:00,0.2716,0.0,0.92,0.08
Economics,"Dollar dives, yields surge: Is this the breaking point for U.S. bond market?",2025-05-26 19:49:51+00:00,0.0,0.0,1.0,0.0
Economics,"Temptation as a Public Policy Problem: Pot, porn, and burritos are part of an ever-growing temptation economy. What do we do about it?",2025-05-26 19:46:48+00:00,-0.4019,0.109,0.891,0.0
Economics,Fed Chair Powell praises integrity and public service amid unrelenting Trump attacks,2025-05-26 15:28:56+00:00,0.4767,0.162,0.503,0.335
Economics,India’s clean energy growth outpaces global trends,2025-05-26 15:22:16+00:00,0.7506,0.0,0.351,0.649
Economics,​India becomes world’s 4th largest economy,2025-05-26 14:56:32+00:00,0.0,0.0,1.0,0.0
Economics,What a slowdown in international travel could mean for America's tourist hubs,2025-05-26 13:32:10+00:00,0.0,0.0,1.0,0.0
Economics,How Student-Loan Crisis Will Show Up in the Economy,2025-05-26 12:41:16+00:00,-0.6249,0.339,0.661,0.0
Economics,I Was Obama’s Budget Director. It’s Time to Worry About the National Debt.,2025-05-26 12:36:46+00:00,-0.6597,0.329,0.671,0.0
Economics,"Moody's Ratings affirms China's A1 ratings, maintains negative outlook (Moody's)",2025-05-26 11:32:04+00:00,-0.5719,0.291,0.709,0.0
Economics,How Trump's spending bill could impact the economy,2025-05-26 11:13:57+00:00,0.0,0.0,1.0,0.0
Economics,"Proceeds from 'millionaires tax' are through the roof, according to state projections",2025-05-26 09:22:16+00:00,0.0,0.0,1.0,0.0
Economics,EUROPE Europe rallies after the 'good' phone call,2025-05-26 05:05:25+00:00,0.4404,0.0,0.707,0.293
Economics,Germany: Bundesverband Elektromobiliät is insolvent,2025-05-26 04:48:28+00:00,0.0,0.0,1.0,0.0
Economics,Samsung on alert as Trump threatens 25% tariff on imported goods.,2025-05-26 04:32:40+00:00,-0.1027,0.188,0.652,0.159
Economics,How the EU is ruining Ukraine’s economy.,2025-05-26 04:12:39+00:00,-0.25,0.25,0.75,0.0
Economics,Trump says he'll delay a threatened 50% tariff on the European Union until July,2025-05-26 01:54:30+00:00,-0.6486,0.306,0.694,0.0
Economics,Trump delays 50% tariffs on EU to July 9,2025-05-25 22:42:24+00:00,0.0,0.0,1.0,0.0
Economics,Trump delays 50% tariffs on EU to July 9,2025-05-25 22:30:24+00:00,0.0,0.0,1.0,0.0
Economics,Fostering Core Government Bond Market Resilience,2025-05-25 21:30:08+00:00,0.0,0.0,1.0,0.0
Economics,China-Iran Rail Corridor: Transforming Eurasian Trade and Geopolitics,2025-05-25 21:26:40+00:00,0.0,0.0,1.0,0.0
Economics,"Europe Freezes US Travel as Lufthansa, British , Air France, KLM and More Slash Routes to Major Cities Including New York, Miami, Los Angeles, and Chicago to Tap Soaring Demand Across Canada, Mexico, Brazil and Caribbean - Travel And Tour World",2025-05-25 19:09:11+00:00,-0.4576,0.116,0.884,0.0
Economics,"U.S. risks losing 'reliable investment' status, Allianz GI manager says | Fortune",2025-05-25 18:17:41+00:00,-0.5719,0.32,0.68,0.0
Economics,The Era of Thrash: The American economy has been in chaos longer than you think.,2025-05-25 15:00:38+00:00,-0.5719,0.209,0.791,0.0
Economics,India registers 3-fold growth in renewable energy capacity to 232GW in last decade,2025-05-25 13:47:37+00:00,0.5719,0.0,0.701,0.299
Economics,"Pivoting From Tax Cuts to Tariffs, Trump Ignores Economic Warning Signs",2025-05-25 13:43:14+00:00,-0.6908,0.456,0.544,0.0
Economics,Trade talks bog down as countries - and White House - race to meet July deadline,2025-05-25 13:38:38+00:00,0.0,0.0,1.0,0.0
Economics,Crypto Is a Threat to the U.S. Financial System,2025-05-25 13:06:45+00:00,-0.5267,0.298,0.702,0.0
Economics,"Europe’s Been Negotiating by the Book, but Trump’s Tearing It Up",2025-05-25 13:02:11+00:00,0.0,0.0,1.0,0.0
Economics,Giant US Companies Are Rushing to Europe to Borrow Money,2025-05-25 12:51:40+00:00,0.0,0.0,1.0,0.0
Economics,These companies will raise prices because of Trump’s tariffs,2025-05-25 10:08:22+00:00,0.0,0.0,1.0,0.0
Economics,Economists Warn Deporting Hundreds of Thousands of Venezuelans Could Devastate U.S. Economy,2025-05-25 08:14:37+00:00,-0.6705,0.355,0.645,0.0
Economics,Behind the chip: How a few firms and nations control a global industry,2025-05-25 07:30:03+00:00,0.0,0.0,1.0,0.0
Economics,Business Software Group Urges Congress to Reauthorize Quantum Initiative,2025-05-25 06:03:39+00:00,0.0,0.0,1.0,0.0
Economics,BLS to Discontinue Selected PPIs,2025-05-25 04:49:01+00:00,0.0,0.0,1.0,0.0
Economics,"Trump’s new tariff threats, IPOs and FII action among 9 factors that’ll steer D-Street this week - The Economic Times",2025-05-25 04:21:19+00:00,-0.4215,0.128,0.872,0.0
Economics,Medicare Advantage Will Be Overpaid by $1.2 Trillion,2025-05-25 01:35:43+00:00,0.25,0.0,0.778,0.222
Economics,Trump’s China Tariff Deal Is About to Come Back to Bite Him,2025-05-24 21:43:09+00:00,0.0,0.0,1.0,0.0
Economics,Economics expert on what Trump's tariffs mean for the EU and US,2025-05-24 21:28:53+00:00,0.0,0.0,1.0,0.0
Economics,Bonkers borrowing and Trump’s bizarre behaviour will push the U.S. to the brink,2025-05-24 19:08:51+00:00,-0.3182,0.161,0.839,0.0
Economics,Short Public Perception Survey: Fiscal Policy Impact,2025-05-24 18:37:09+00:00,0.0,0.0,1.0,0.0
Economics,"Canada recession has already begun as trade war rages on, economists say",2025-05-24 17:29:21+00:00,-0.8689,0.521,0.479,0.0
Economics,How rich is the Ivy League?,2025-05-24 17:08:53+00:00,0.5574,0.0,0.581,0.419
Economics,When Policymakers Ignore Economists’ Warnings the Results Have Historically Been Catastrophic,2025-05-24 16:37:56+00:00,-0.7845,0.497,0.503,0.0
Economics,Change is coming for the penny as Treasury Department makes final order of the coin,2025-05-24 15:39:11+00:00,0.2023,0.0,0.886,0.114
Economics,American venture capital is flowing into India like never before. Here's why,2025-05-24 14:57:07+00:00,0.3612,0.0,0.815,0.185
Economics,China expands global influence with $500 million WHO donation - The Washington Post,2025-05-24 14:46:13+00:00,0.1027,0.0,0.896,0.104
Economics,Here are all the reasons the economy is limping into Memorial Day weekend,2025-05-24 14:24:14+00:00,0.0,0.0,1.0,0.0
Economics,Map of U.S. Median Household Income by County,2025-05-24 11:13:13+00:00,0.0,0.0,1.0,0.0
Economics,Denmark raises retirement age to 70 — the highest in Europe,2025-05-24 11:02:06+00:00,0.0,0.0,1.0,0.0
Economics,Ranked: World Carbon Emissions by Country,2025-05-24 10:39:09+00:00,0.0,0.0,1.0,0.0
Economics,Trump says he’s ‘not looking for a deal’ with the EU after threatening a 50% tariff,2025-05-24 10:12:47+00:00,-0.5267,0.185,0.815,0.0
Economics,EU plans new fund to help tech companies scale,2025-05-24 08:06:02+00:00,0.4019,0.0,0.748,0.252
Economics,Lutnick: Current 10 percent tariffs not increasing prices,2025-05-24 07:51:08+00:00,0.0,0.0,1.0,0.0
Economics,"Trump’s ‘big, beautiful’ budget is spooking investors",2025-05-24 07:24:50+00:00,0.0,0.0,1.0,0.0
Economics,The Debt Is About to Matter Again,2025-05-24 06:49:55+00:00,-0.34,0.291,0.581,0.128
Economics,Treasury Department set to phase out the penny,2025-05-24 06:45:04+00:00,0.2023,0.0,0.795,0.205
Economics,US Importers Pay Record $16.5 Billion as April Tariff Bill Lands,2025-05-24 06:42:27+00:00,-0.1027,0.123,0.877,0.0
Economics,"Trump threatens 25% tariffs on Apple, Samsung smartphones not made in US.",2025-05-24 05:48:29+00:00,-0.3818,0.191,0.809,0.0
Economics,U.S. Dollar Falls to Lowest Level Since 2023 After Tariff Threats and Deficit Fears,2025-05-24 05:40:29+00:00,-0.872,0.522,0.478,0.0
Economics,Trump’s E.U. Tariff Threat Could Cause Economic Damage Beyond Europe,2025-05-24 05:28:41+00:00,-0.765,0.452,0.548,0.0
Economics,Seal of approval for IT technology from Europe,2025-05-24 05:12:46+00:00,0.4767,0.0,0.693,0.307
Economics,"Companies break record, but tech stocks no longer major driver",2025-05-24 05:08:13+00:00,-0.4215,0.237,0.763,0.0
Economics,"IonQ CEO on the potential of quantum computing, the quantum trade and growth",2025-05-24 04:10:22+00:00,0.3818,0.0,0.822,0.178
Economics,"European stocks tumble, bonds rally after Trump proposes 50% EU tariff",2025-05-24 03:42:49+00:00,0.0,0.0,1.0,0.0
Economics,Should the U.S. Decouple from China?,2025-05-24 02:40:45+00:00,0.0,0.0,1.0,0.0
Economics,Tariff math leaves retailers very little choice on prices,2025-05-24 02:20:04+00:00,0.0,0.0,1.0,0.0
Economics,"As above, So below.",2025-05-24 02:06:22+00:00,0.0,0.0,1.0,0.0
Economics,Americans Aren’t Buying Trump’s Economic Agenda. The Numbers Prove It.,2025-05-23 20:20:56+00:00,0.0,0.0,1.0,0.0
Economics,The One Big Beautiful Breakdown: What This New Budget Bill Really Means for You,2025-05-23 19:00:34+00:00,0.5994,0.0,0.769,0.231
Economics,Trump suggests 50% tariff on EU goods starting in June.,2025-05-23 18:37:00+00:00,0.0,0.0,1.0,0.0
Economics,New-Vehicle Retail Sales Rise 1.1% in May as Tariff-Driven Rush to Showrooms Tapers Off; Consumers Spend Record Amount for May (J.D. Power),2025-05-23 17:50:25+00:00,0.0,0.0,1.0,0.0
Economics,Oil Rig Count Plunges Amid Scary Price Environment | OilPrice.com,2025-05-23 17:38:39+00:00,-0.5719,0.37,0.63,0.0
Economics,Trump Has Cut Science Funding to Its Lowest Level in Decades,2025-05-23 16:28:00+00:00,-0.5719,0.343,0.657,0.0
Economics,G-7 Warns of ‘Excessive Imbalances’ in Global Economy,2025-05-23 16:13:33+00:00,-0.1027,0.167,0.833,0.0
Economics,Trump’s new bill threatens major tax increases for Canadian companies,2025-05-23 15:19:42+00:00,-0.3818,0.224,0.776,0.0
Economics,Trump says he is hitting EU with 50% tariff as trade talks are ‘going nowhere’,2025-05-23 14:40:47+00:00,0.0,0.0,1.0,0.0
Economics,Markets open lower after Trump threatens tariffs on Apple and E.U.,2025-05-23 14:20:13+00:00,-0.5859,0.348,0.652,0.0
Economics,Trump threatens 50% tariffs on EU and 25% on iPhones,2025-05-23 14:09:48+00:00,-0.3818,0.224,0.776,0.0
Economics,US debt fears put dollar on track for worst week since tariffs sell-off • Greenback falls 1.6% amid concerns over impact of Trump’s tax-cutting bill,2025-05-23 14:07:00+00:00,-0.8555,0.299,0.701,0.0
Economics,"MONTHLY NEW RESIDENTIAL SALES, APRIL 2025",2025-05-23 14:05:12+00:00,0.0,0.0,1.0,0.0
Economics,Trump recommends 50% tariff on European Union starting June 1,2025-05-23 12:28:29+00:00,0.2263,0.0,0.826,0.174
Economics,"Trump says talks with E.U. are 'going nowhere,' will implement 50% tariff in June",2025-05-23 12:10:58+00:00,0.0,0.0,1.0,0.0
Economics,Trump threatens Apple with a 25% tariff if it doesn’t build iPhones in America,2025-05-23 11:54:13+00:00,-0.3818,0.167,0.833,0.0
Economics,Robert Kiyosaki Predicts Dollar Collapse and Hyperinflation. What’s Fact—and What’s Alarmism?,2025-05-23 11:36:28+00:00,-0.5423,0.333,0.667,0.0
Economics,Spain Pushes Ahead With Plan to Tax Non-EU Home Buyers 100%,2025-05-23 11:28:29+00:00,0.0,0.0,1.0,0.0
Economics,Germany’s GDP growth in Q1 2025 was revised up to 0.4% QoQ in the final estimate from 0.2% QoQ in the initial estimate (Destatis),2025-05-23 11:26:09+00:00,0.3818,0.0,0.898,0.102
Economics,"Germany builds 14% fewer apartments in 2024, falling short of government goals",2025-05-23 10:15:30+00:00,-0.1531,0.127,0.873,0.0
Economics,German economy sees unexpected 0.4% growth in first quarter,2025-05-23 10:10:56+00:00,0.3818,0.0,0.755,0.245
Economics,"US invites Asian officials to Alaska, eyes $44 billion LNG project",2025-05-23 07:45:55+00:00,0.0,0.0,1.0,0.0
Economics,Editorial: South Korea faces debt reckoning as global bond markets wobble.,2025-05-23 05:14:02+00:00,-0.3612,0.2,0.8,0.0
Economics,Solar shines as Germany's top electricity source in April,2025-05-23 04:23:14+00:00,0.2023,0.0,0.816,0.184
Economics,"China isn’t getting rid of its controls over rare earths, despite trade truce with US",2025-05-22 23:25:17+00:00,0.0,0.0,1.0,0.0
Economics,"Why the bond market is so worried about the ‘Big, Beautiful Bill’",2025-05-22 21:40:39+00:00,0.2579,0.171,0.596,0.233
Economics,Supreme Court insulates Federal Reserve while backing Trump firing of agency leaders,2025-05-22 21:18:20+00:00,0.3182,0.149,0.559,0.292
Economics,"What to know about $1,000 ""Trump accounts"" for newborns included in House bill",2025-05-22 21:14:36+00:00,0.0,0.0,1.0,0.0
Economics,"EU-Mexico trade deal could be finalized before year-end, Italy's Tajani says",2025-05-22 21:00:34+00:00,0.0,0.0,1.0,0.0
Economics,Japan’s panic bond sell-off should send shivers down Trump’s spine,2025-05-22 20:37:31+00:00,-0.5106,0.268,0.732,0.0
Economics,The Treasury unveils its plan to kill the penny,2025-05-22 20:35:52+00:00,-0.5994,0.348,0.519,0.133
Economics,The distant dream of owning a home: Canada sees growing inequality in home ownership,2025-05-22 20:34:53+00:00,0.4019,0.0,0.764,0.236
Economics,"FACTBOX: US port fees on foreign ships to shake up trade flows, freight markets",2025-05-22 20:22:34+00:00,-0.1779,0.116,0.884,0.0
Economics,Ray Dalio says to fear the bond market as deficit becomes critical,2025-05-22 19:55:01+00:00,-0.802,0.477,0.523,0.0
Economics,US bond sell-off is creating a debt spiral,2025-05-22 19:46:51+00:00,-0.0772,0.234,0.561,0.206
Economics,The 5% remittance tax threat: A new flashpoint between Mexico and the US,2025-05-22 19:43:18+00:00,-0.5267,0.221,0.779,0.0
Economics,"College grads face a ‘tough and competitive’ job market this year, expert says",2025-05-22 19:35:32+00:00,0.0,0.0,1.0,0.0
Economics,Honda Celebrates Historic Milestone: 500 Million Motorcycles Produced Worldwide,2025-05-22 18:40:40+00:00,0.5719,0.0,0.684,0.316
Economics,Canada's crude oil shift to China schools Trump in unintended consequences,2025-05-22 18:22:53+00:00,-0.5719,0.27,0.73,0.0
Economics,"Are May flowers wilting? Consumers continued to moderate spending through mid-May, especially on durables like electronics and autos (Bank of America)",2025-05-22 18:05:18+00:00,0.4144,0.0,0.879,0.121
Economics,No Majority Demand for Deregulation,2025-05-22 17:38:48+00:00,-0.2095,0.335,0.457,0.209
Economics,US Mint moves forward with plans to kill the penny,2025-05-22 15:47:39+00:00,-0.6908,0.343,0.657,0.0
Economics,Bond selloff rolls on as US House passes Trump's 'big beautiful' tax bill,2025-05-22 14:32:00+00:00,0.5994,0.0,0.755,0.245
Economics,UK petrol prices poised to fall further as oil prices tumble,2025-05-22 14:22:56+00:00,0.25,0.0,0.833,0.167
Economics,BYD sells more EVs than Tesla in Europe for the first time.,2025-05-22 13:55:54+00:00,0.0,0.0,1.0,0.0
Economics,"Amazon CEO Says Customer Demand, Prices Steady Despite Tariffs",2025-05-22 13:26:11+00:00,0.0516,0.147,0.686,0.167
Economics,"JP Morgan warns that stagflation, an economic nightmare scenario, is still a risk",2025-05-22 13:24:18+00:00,0.0085,0.218,0.624,0.158
Economics,House passes Trump’s sweeping domestic policy bill after GOP leaders win over key holdouts,2025-05-22 13:16:59+00:00,0.5859,0.0,0.774,0.226
Economics,German economy: When will it pick up again?,2025-05-22 13:04:43+00:00,0.0,0.0,1.0,0.0
Economics,"Trump’s tax bill to cost 830,000 jobs and drive up bills and pollution emissions, experts warn",2025-05-22 11:54:11+00:00,-0.1027,0.085,0.915,0.0
Economics,Global shares slip as investors register their worries about U.S. debt,2025-05-22 11:44:14+00:00,-0.4767,0.342,0.516,0.142
Economics,Understanding the impact of changing tariffs on GDP (OECD),2025-05-22 11:34:28+00:00,0.0,0.0,1.0,0.0
Economics,Personal Bankruptcy Statistics: Chapter 7 and Chapter 13,2025-05-22 10:50:48+00:00,0.0,0.0,1.0,0.0
Economics,Retail heavyweights torn over how to handle tariff pain,2025-05-22 08:47:34+00:00,-0.6486,0.431,0.569,0.0
Economics,Pakistan creates Digital Asset Authority,2025-05-22 08:20:50+00:00,0.5994,0.0,0.253,0.747
Economics,US Bonds Seen at Risk of Liz Truss Moment as Deficit Balloons,2025-05-22 07:17:17+00:00,-0.5859,0.324,0.676,0.0
Economics,G7 finance chiefs seek unity as Canada talks near end.,2025-05-22 06:02:49+00:00,0.0,0.0,1.0,0.0
Economics,"Peru is currently negotiating 4 new trade agreements, including a FTA with India.",2025-05-22 05:28:01+00:00,0.2732,0.0,0.851,0.149
Economics,German industry crisis: Can cheap power help?,2025-05-22 05:27:49+00:00,-0.34,0.347,0.424,0.229
Economics,Commercial diplomacy and deals ‘core focus’ of US-Africa policy.,2025-05-22 05:23:09+00:00,0.0,0.0,1.0,0.0
Economics,"Germany readying 1.5% of GDP for dual military use infrastructure, says Merz",2025-05-22 05:20:06+00:00,0.0,0.0,1.0,0.0
Economics,"50 million Americans now own Bitcoin, ditching gold",2025-05-22 03:27:42+00:00,0.0,0.0,1.0,0.0
Economics,Texas House of Representatives Approves Ban on Hemp-Derived THC,2025-05-22 03:23:50+00:00,-0.2263,0.271,0.526,0.203
Economics,Does the adoption of direct-seeded rice affect pesticide use? Evidence from China,2025-05-22 03:04:21+00:00,0.0,0.0,1.0,0.0
Economics,"Bird Flu Outbreak Hits Brazil’s Poultry Industry, Threatening Exports",2025-05-21 23:32:08+00:00,-0.7184,0.462,0.538,0.0
Economics,"This Is Terrifying. It shouldn't be. But it is. FRED, ALFRED, and FRED Account will undergo scheduled maintenance on May 27 at 8 PM Central Time. Connection to some features may be unavailable. Thank you for your patience and we apologize for any inconvenience.",2025-05-21 23:31:48+00:00,-0.1901,0.111,0.793,0.096
Economics,Senate passed a surprise 'no tax on tips' bill. Here's what it could mean for workers,2025-05-21 23:07:18+00:00,0.2732,0.0,0.877,0.123
Economics,US and Japanese Bonds are sending negative messages about the economy!,2025-05-21 23:07:05+00:00,-0.6114,0.285,0.715,0.0
Economics,Greece borrows cheaper than the US for up to 30 years - ProtoThema English,2025-05-21 22:50:00+00:00,0.0,0.0,1.0,0.0
Economics,"Will EU deal make food cheaper, add $12bn to the UK economy?",2025-05-21 20:02:31+00:00,0.0,0.0,1.0,0.0
Economics,What do encampments offer that shelters don’t? A chance to build community,2025-05-21 20:02:19+00:00,0.25,0.0,0.846,0.154
Economics,The extremely bad housing record of Canada's new housing minister,2025-05-21 19:24:09+00:00,-0.5849,0.296,0.704,0.0
Economics,CATL: Chinese battery billionaire doesn't want US investors at his party CATL has raised $4.1 billion on the Hong Kong  stock exchange to expand into the EU. Founder and CEO Zeng Yuqun has barred US investors from participating.,2025-05-21 18:55:32+00:00,0.5828,0.03,0.849,0.121
Economics,Meet the insurgent economists promoting a global wealth tax,2025-05-21 17:25:42+00:00,0.6908,0.0,0.551,0.449
Economics,US states mount court challenge to Trump's tariffs,2025-05-21 16:27:50+00:00,0.0772,0.0,0.843,0.157
Economics,US and China are already feuding again after unexpected trade truce,2025-05-21 16:21:08+00:00,-0.3818,0.206,0.794,0.0
Economics,Trump's tariffs will test unity among allies at G7 finance ministers' summit,2025-05-21 15:38:31+00:00,0.0,0.0,1.0,0.0
Economics,The GOP Tax Bill Ignores Decades of Economic Research,2025-05-21 15:04:04+00:00,-0.2732,0.208,0.792,0.0
Economics,"Trump and GOP’s tax bill would force cuts to Medicare, CBO says",2025-05-21 14:22:28+00:00,-0.296,0.167,0.833,0.0
Economics,Target cuts sales outlook as retailer blames tariff uncertainty and backlash to DEI rollback,2025-05-21 14:11:23+00:00,-0.743,0.399,0.601,0.0
Economics,China installs kill switches in solar panels sold to the West; here’s why it’s extremely dangerous and how Beijing could trigger a world war,2025-05-21 14:01:38+00:00,-0.9184,0.364,0.636,0.0
Economics,Raising Social Security’s Retirement Age Is the Least Bad Option,2025-05-21 13:21:41+00:00,0.431,0.0,0.759,0.241
Economics,"Unemployment warning sign: Beveridge curve indicates US at turning point, unemployment could accelerate as job openings fall (see comments)",2025-05-21 12:36:02+00:00,-0.802,0.339,0.661,0.0
Economics,"If The Rich Are So Powerful, Why Are Their Taxes So High?",2025-05-21 12:12:20+00:00,0.7713,0.0,0.599,0.401
Economics,India's Russian oil imports hit 10-month high on strong demand for ESPO crude,2025-05-21 11:55:43+00:00,-0.2263,0.281,0.541,0.178
Economics,US export curbs on AI chips to China 'a failure' — Nvidia,2025-05-21 10:43:24+00:00,-0.5106,0.231,0.769,0.0
Economics,"German economy set for zero growth thanks largely to Trump, government advisers say",2025-05-21 10:41:38+00:00,0.6705,0.0,0.667,0.333
Economics,UBS: Trump is preparing another round of tariffs this summer,2025-05-21 09:31:12+00:00,0.0,0.0,1.0,0.0
Economics,UK inflation climbs to 15-month high as bills rise,2025-05-21 09:12:05+00:00,0.0,0.0,1.0,0.0
Economics,What Trump could do if he's serious about trying to make companies 'eat' tariff price hikes,2025-05-21 09:06:51+00:00,-0.0772,0.08,0.92,0.0
Economics,"Trump Is Slowly but Surely Killing U.S. Economy, Experts Warn",2025-05-21 04:48:15+00:00,-0.5927,0.415,0.377,0.208
Economics,Nippon Steel still committed to full US Steel takeover: executive.,2025-05-21 04:28:09+00:00,0.2732,0.0,0.811,0.189
Economics,Cooking the books? Fears Trump could target statisticians if data disappoints: Proposed rule change could pave way for president to fire economists whose figures prove politically inconvenient,2025-05-21 03:25:43+00:00,-0.8481,0.307,0.693,0.0
Economics,Japan exports growth slows for a second straight month as U.S. tariffs bite,2025-05-21 00:22:00+00:00,0.5423,0.0,0.71,0.29
Economics,"USDA approves soda ban for Food Stamps in Nebraska, reversing decades of policy.",2025-05-21 00:01:22+00:00,-0.2263,0.208,0.636,0.156
Economics,Fed officials expect tariffs to boost prices; White House downplays risk,2025-05-20 21:43:43+00:00,0.1531,0.152,0.652,0.196
Economics,U.K. Trade Deals Bare the Reality: It’s a Midsize Economy Among Giants,2025-05-20 20:05:18+00:00,0.0,0.0,1.0,0.0
Economics,"U.S. economy is experiencing ‘death by a thousand cuts’, says Deutsche Bank, as confidence in national debt management erodes",2025-05-20 19:57:11+00:00,0.2023,0.11,0.746,0.145
Economics,Quantinuum CEO Rajeeb Hazra on US-Qatar Quantum Deal,2025-05-20 18:52:15+00:00,0.0,0.0,1.0,0.0
Economics,Tariffs Create Markets — Just Not the Ones Policymakers Want,2025-05-20 18:50:19+00:00,0.34,0.0,0.702,0.298
Economics,"Leading Economic Index falls fastest in two months since pandemic, down 1.0% in April after 0.8% drop in March",2025-05-20 17:53:55+00:00,-0.2732,0.104,0.896,0.0
